id,location,start_time,end_time,instructor,instructor_kingdom,instance_id,name,track,culture,topic_and_subtopic,adult_only,description_book,description_web,duration,fee_itemization,handout_fee,handout_limit,material_fee,material_limit,repeat_count,updated_at
2440,Denys the Decadent (Denys the Decadent's Camp),2015-07-27 08:00:00 -0400,2015-07-27 09:00:00 -0400,Master Denys the Decadent,æthelmearc,3604,12-Step Meetings,Pennsic University,Multiple Cultures,,false,"12-step meeting open to all recovery programs. AA, NA, OA, GA, SA, Alanon, etc.","Open meeting; all are welcome. 12-step meeting open to all recovery programs: AA, NA, OA, GA, SA, Alanon, etc.",1.0,"",,,,,11,2015-04-15 21:23:16 -0400
3085,Encampment of Erica Paige (W10),2015-07-27 11:00:00 -0400,2015-07-27 12:00:00 -0400,Erica Paige,east,4469,Introduction to Spinning *Poi*,Pennsic University,Other,,false,Learn some of the basic *poi* movements and terminology necessary to get you started.,"In this one-hour workshop, you will learn some of the basic *poi* movements and terminology necessary to get you started. *Poi* spinning is a great low-impact workout that will help you to improve your coordination and give your fitness routine some ""flare""! $20 Material Fee includes your choice of Home of Poi - Sock Poi and a storage pouch. Handout with class review & contacts. Refreshments are also served. ",1.0,"$20.00 Material Fee covers handout, poi, and refreshments",,,20.0,,3,2015-05-06 13:48:04 -0400
2540,Archery,2015-07-27 12:00:00 -0400,2015-07-27 14:30:00 -0400,Master Godric of Hamtun,east,3770,Range Set-up,Archery,"",,false,"Volunteers are requested to help set up the Archery Range on Monday, July 27, starting at 9 am. Archery marshals and non-marshals alike are welcome.","Volunteers are requested to help set up the Archery Range on Monday, July 27, starting at 9 am. Archery marshals and non-marshals alike are welcome.",2.5,"",,,,,1,2015-04-26 18:23:29 -0400
3079,A&S 2,2015-07-27 15:00:00 -0400,2015-07-27 16:30:00 -0400,THL Sciath ingen Chaennaig,ealdormere,4458,Heraldry Design Basics,Heraldry,Other,,false,"What better way to get your device submission in shape for Herald's Point, than by learning about heraldry design basics. ","What better way to get your device submission in shape for Herald's Point, than by learning about heraldry design basics. This class will include an introduction to device design, based on the SCA rules of Heraldry. Some one-on-one assistance will be provided.  ",1.5,Handouts: $2,2.0,10,,,3,2015-05-06 00:51:36 -0400
2243,Livonia Smithery (170),2015-07-27 15:00:00 -0400,2015-07-27 16:00:00 -0400,Lord T W,æthelmearc,3430,Advanced Engraving,Pennsic University,"",,true,The continuation of the work begun in the beginning class. Hand-engraving on copper plate. Letters and design work.,The continuation of the work begun in the beginning class. Hand-engraving on copper plate. Letters and design work.,1.0,handout,5.0,12,,,5,2015-04-08 17:51:30 -0400
3152,A&S 2,2015-07-27 18:00:00 -0400,2015-07-27 19:00:00 -0400,Lady Arastorm ,east,4550,Anglo-Saxon Context: Late Roman World ,Pennsic University,European,,false,"Neighboring cultures inform us about the Anglo-Saxons. We'll focus on the late Roman world, both survivals of the Romano-British and Roman/Byzantine.","To understand Anglo-Saxons we need to understand the people with whom they interacted, what came before and after. This series of workshops looks at the surrounding cultures through the lens of their interaction with the Anglo-Saxons. This workshop focuses on the the continuing influence of Rome. We'll cover the Romano-British culture and the cultures of the Mediterranean: Lombard, Visigoth, and other heirs to the Roman Empire, especially Constantinople.",1.0,"",,15,,,1,2015-06-09 21:28:16 -0400
2361,A&S 13,2015-07-27 19:00:00 -0400,2015-07-27 19:45:00 -0400,Lord Jacob the Wanderer,east,3469,Bedtime Stories for Children,Pennsic University,Other,,false,Nightly telling of stories for children.    ,7 pm nightly: Stories and fables for children. All are welcome to attend; must have adult escort.,0.75,"",,,,,11,2015-04-06 15:17:48 -0400
2440,Denys the Decadent (Denys the Decadent's Camp),2015-07-28 08:00:00 -0400,2015-07-28 09:00:00 -0400,Master Denys the Decadent,æthelmearc,3605,12-Step Meetings,Pennsic University,Multiple Cultures,,false,"12-step meeting open to all recovery programs. AA, NA, OA, GA, SA, Alanon, etc.","Open meeting; all are welcome. 12-step meeting open to all recovery programs: AA, NA, OA, GA, SA, Alanon, etc.",1.0,"",,,,,11,2015-04-15 21:23:16 -0400
2477,Rapier List 2,2015-07-28 08:00:00 -0400,2015-07-28 09:00:00 -0400,Countess Elena d'Artois,æthelmearc,3644,*Études* 1 and 2 for Single Sword (Fencing),Rapier Activities,European,,false,"For all levels and teachers. Drills focus on form, balance, movement and coordination. *Études* for drill; elements from drill used to work in groups.","For beginner and intermediate fencers and those who teach them. These drills will focus on form, balance, movement and coordination. *Étude*1 (first week) is more linear; *Étude* 2 (second week) adds off line/lateral movement. Emphasis will be on learning the *études* for home drill, as well as taking elements out of the drill for more focused work in groups. ",1.0,"",,,,,7,2015-05-14 19:19:33 -0400
2267,A&S 1,2015-07-28 09:00:00 -0400,2015-07-28 11:00:00 -0400,Lady Gwen Blackthorne MacGriogair,meridies,3311,Beginning Kumihimo,Pennsic University,Far Eastern,,false,"Part 1: Learn the basics of Japanese braiding using the modern foam disk. Students will learn a round, square and flat braid.","Part 1: Learn the basics of Japanese braiding using the modern foam disk. Students will learn a round, square and flat braid. Uses for, history and names of braids will be discussed. Students may bring own equipment if desired.",2.0,total class is 10.00 if just handout 3.00,3.0,20,10.0,20,2,2015-03-25 19:16:19 -0400
3019,A&S 2,2015-07-28 09:00:00 -0400,2015-07-28 11:00:00 -0400,Mistress Alicia Langland,æthelmearc,4420,Thorsberg Trousers: Pants That Last!,Pennsic University,European,,false,Tired of repairing pants that rip in unmentionable places? Then you’ll love these pants based on trousers from an Iron Age burial!,"Tired of repairing pants that rip in unmentionable places? Then you’ll love these pants based on trousers from an Iron Age burial! Learn what you’ll need to make them yourself: fabrics, seams, pattern, and construction.",2.0,Handout is 11 pages long.,3.0,35,,,2,2015-05-03 20:56:11 -0400
2252,A&S 3,2015-07-28 09:00:00 -0400,2015-07-28 11:00:00 -0400,THL Amanita Villarosa,middle,3297,Beginner Knitting,Pennsic University,Other,,false,"Learn how to cast on, knit, purl, and cast off. Feel free to bring your own needles and yarn.","",2.0,"$2.50 - needles
$2.50 - yarn",,,5.0,10,2,2015-03-25 17:49:40 -0400
3153,A&S 12,2015-07-28 09:00:00 -0400,2015-07-28 10:00:00 -0400,Lady Arastorm ,east,4547,Anglo-Saxon Context: Celts: Wales Ireland Scotland,Pennsic University,European,,false,"Neighboring cultures inform us about the Anglo-Saxons. We'll focus on the Celtic kingdoms of Wales, Ireland and Scotland's interactions with England.","To understand Anglo-Saxons we need to understand the people with whom they interacted, what came before and after. This series of workshops looks at the surrounding cultures through the lens of their interaction with the Anglo-Saxons. This workshop focuses on the Celtic kingdoms of Wales, Ireland and Scotland: how they interacted with the English - and were changed by them.",1.0,"",,15,,,1,2015-06-10 04:34:44 -0400
2866,Dance Tent,2015-07-28 09:00:00 -0400,2015-07-28 10:00:00 -0400,Lady Rebecca da Firenze,west,4161,Children's Dance: Branles and More!,European Dance,European,,false,It's never too early to learn to dance! Expect branles; other dances as time allows! (Any youth in attendance require a responsible adult present.),"It's never too early to learn to dance! Come learn dances fun for all ages. This class will have a focus on branles, both miming and tangle, but will include other dances as time allows! Parents are welcome and, indeed, encouraged to attend. For children under 12, Pennsic rules require a responsible adult to accompany them.",1.0,"",,,,,1,2015-05-07 20:44:20 -0400
2348,Hus Faerhaga (N08),2015-07-28 09:00:00 -0400,2015-07-28 12:00:00 -0400,THL Kai SaerPren,east,3456,Intro to Woodworking,Pennsic University,European,,true,Introduction to woodworking with only hand tools. Includes modern SOPs and safe practices for the purposes of building medieval-style furniture.,"Two half days Tuesday and Wednesday; an overview of hand wood work, with an opportunity to try things out. We will start on Tuesday morning with a chunk of a log and by noon we should have some boards or other furniture parts using wedges, axes, froes, drawknives, spokeshaves and wood planes. On Wednesday we will look at making joints, boring, and maybe a bit of carving. Covers saws, chisels, and planes. Extensive instructions on the selection, use and maintenance of all these tools will be covered. The class will be taught both first week and again second week. Students who cannot attend the whole class are encouraged to drop in or out at their convenience.",3.0,"",,,,,2,2015-06-28 21:28:57 -0400
2173,Amphitheater,2015-07-28 10:00:00 -0400,2015-07-28 11:00:00 -0400,Lady Noelle de la Plume,middle,3184,Fool School,Performing Arts and Music,Other,,false,Are you a fool or a fool wannabe? Come to Fool School to share and learn. Prepare a 5-minute skit to perform. All ages/experience levels welcome.,"Are you a fool or a fool wannabe? Come to Fool School to share and learn. Fools/performers of all types and experience levels are welcome. Jugglers, magicians, singers, freaks and geeks. Get help creating or honing a skit of no more than 5 minutes to perform in the Amphitheater Wednesday 8/6 6-7 pm.
You might even become a “Licensed Fool.” Performing is not mandatory.",1.0,"",,,,,9,2015-05-04 22:26:09 -0400
2892,A&S 6,2015-07-28 10:00:00 -0400,2015-07-28 12:00:00 -0400,Mistress Isabel Ximenex de Gaucin,east,4201,Beautiful Neckline Finishing,Pennsic University,European,,false,Hands-on class. Learn how to finish a neckline based on extant examples from the 13th century. Technique uses a bias-cut strip.,"Hands-on class. Learn how to finish a neckline based on extant examples from the 13th century. Technique uses a bias-cut strip and makes a beautifully finished neckline. If you have needle, thread and scissors, please bring them. If there is time remaining, we will also go over a seam finishing technique.",2.0,"",,,,10,2,2015-05-01 19:15:14 -0400
2611,A&S 7,2015-07-28 10:00:00 -0400,2015-07-28 11:00:00 -0400,Instructor Gin,æthelmearc,3856,Ninja: Truth from Shadows,Pennsic University,Far Eastern,,false,Dare you look into the shadows of history to find the truth? Come to discover both the legends and real history of Japan's famed assassins. New info!,Dare you look into the shadows of history to find the truth? Come to discuss and discover both legends and the real history of Japan's famed spies and assassins. This class will examine the romanticized image of the Ninja and discuss the actual history of the world's most famous spies.,1.0,"",,20,,,4,2015-04-26 14:17:14 -0400
2169,A&S 8,2015-07-28 10:00:00 -0400,2015-07-28 11:00:00 -0400,Mistress Rhiannon y Bwa,æthelmearc,3180,Wool Spinning on Many Distaffs: Hands-On,Pennsic University,European,,false,Learn the use of the iconic distaff. Distaffs are not just for flax! Learn how to prepare wool to spin and mount it on various styles of distaffs. ,"Learn the use of the iconic distaff. Distaffs are not just for flax! To a spinster, a distaff functions as a third hand, holding a large quantity of fiber in orderly condition as she pulls down fiber to fill her spindle. Come and learn about several types of distaff designs and how to mount wool prepared in various ways on them. Great for hot, sticky or windy weather. Keep the wool on the distaff, not on you!!!! Spinsters often find the evenness of their yarn improves when mounted on a distaff.  And if you walk around a lot…. 'porting your distaff with spindle tucked into the cross lacing is so easy. Improve your Pennsic spinning experience. Loaner spindles and distaffs are available for students who don't wish to purchase them.

I have just produced some YouTube videos on Medieval Spinning that you might enjoy before coming to Pennsic, but not required! http://www.youtube.com/playlist?list=PLjUCUOUGq_WC-sv2N_qfIhpJDi8LbR-9U, or just search YouTube for ""missingspindle"". Discussion of medieval spinning info is on my blog here: ""missingspindle.blogspot.com""",1.0,"Loaner Distaff=$0.00
Purchased distaffs=$35.00",1.0,15,,15,2,2015-03-01 14:33:13 -0500
3157,A&S 12,2015-07-28 10:00:00 -0400,2015-07-28 11:00:00 -0400,Lady Arastorm ,east,4556,Anglo-Saxon Medicine  ,Pennsic University,European,,false,"The Anglo-Saxons used herbs, surgery, and magick to deal with chronic and acute illness and injury. What did they use, and what can we safely use now?","Anglo-Saxons' medicine included herbs, surgery, and magick. They dealt with  injuries, chronic and acute illness. Recent tests showed some receipts from their leech books effective, although clearly some remedies are better to read about than try. We'll look at sources, herbal remedies, healing magick, and other techniques (like surgery), who practitioners were, and what self treatment was like. You may find something you can use, you will find many things to amuse.",1.0,"",,15,,,1,2015-05-27 18:59:48 -0400
2725,Dance Tent,2015-07-28 10:00:00 -0400,2015-07-28 11:00:00 -0400,THL Gianna Vettori,middle,3955,"Italian Dance for English Feet: *Anello, Fedelta*",European Dance,European,,false,Don't let Italian dances intimidate you! Come to learn two simple Italian dances taught with the English Country dancer in mind.,"Italian dances can often seem quite intimidating for dancers just getting steady on their English Country feet. Explore two of the more simple yet visually appealing Italian dances, *Anello* and *Fedelta*, taught with English Country terminology.",1.0,"",,20,,,1,2015-05-07 11:51:12 -0400
2209,Performing Arts Rehearsal Tent,2015-07-28 10:00:00 -0400,2015-07-28 13:00:00 -0400,Pennsic Performing Arts,"",3246,Set-up: Rehearsal and Class Tent,Performing Arts and Music,"",,false,"Set-up Rehearsal and Class Tent: signs, chairs, and other necessary Performing Arts properties for classes and events.","Set-up Rehearsal and Class Tent: signs, chairs, and other necessary Performing Arts properties for classes and events.",3.0,"",,,,,1,2015-04-30 20:44:54 -0400
2399,University Point,2015-07-28 10:00:00 -0400,2015-07-28 12:00:00 -0400,"Master Emrys Eustace, yclept Broom",æthelmearc,3519,Weed Walk ,Pennsic University,Other,,false,Wild plant identification. Wear walking shoes and hat; leave from Univ. Point. Different teachers on different days; walk with us more than once!,"Cooper's Lake abounds with medicinal and food plants that were used by various primitive and medieval cultures. Learn to identify them during a walk around the campsite. The walk will take place rain or shine. Please wear sturdy shoes and a hat. Meet at University Point for the start of the class. We have three wonderful new teachers this year, enabling us to offer this class more times!",2.0,"",,,,,11,2015-04-12 20:27:32 -0400
2941,Middle Eastern Tent,2015-07-28 10:30:00 -0400,2015-07-28 11:45:00 -0400,Christy Fricks,atlantia,4242,Belly Dance for Girls and Teens,Middle Eastern,Middle Eastern,,false,Basic belly dance for girls and teens. Parents may attend with children. Learn basic movements and some cultural background. All levels welcome,"Basic belly dance for girls and teens. Parents may attend with their children. Teens are welcome to attend both this and my adult class. Learn fun easy-to-do basic movements of belly dance...along with the cultural historical background of belly dance. All levels of ability welcome.
",1.25,"",,,,,1,2015-05-04 19:07:37 -0400
2208,Performing Arts Tent,2015-07-28 10:30:00 -0400,2015-07-28 20:30:00 -0400,Pennsic Performing Arts,"",3248,Set-up: Performing Arts Tent,Performing Arts and Music,"",,false,"Set-up in Performing Arts Tent: stage decks and tops, stage back drop, curtains, backstage area, signs, lights, and other PA properties.","On Tuesday and Wednesday of Land Grab Week, we build the stage, hang curtains, rig the house and backstage lights, and set up the chairs. This starts at about 10 am each day and continues until we are done. Come help us make the tent into a theater worthy of the name!  Bring your cordless drills and other hand tools. On Tuesday we also set up the Amphitheater and the Performing Arts Rehearsal Tent. ",10.0,"",,,,,2,2015-03-26 20:33:43 -0400
2437,Amphitheater,2015-07-28 11:00:00 -0400,2015-07-28 12:00:00 -0400,Lord William Kilmaron,middle,3595,Juggling 101 (Beginner),Performing Arts and Music,"",,false,Learn to juggle three balls in the simplest pattern. Equipment available for use or purchase. ,The most basic 3-ball cascade juggling. Juggling balls will be made available for use by the class and may be bought afterward from the instructor. ,1.0,"",,,,,3,2015-05-01 00:06:45 -0400
2374,A&S 1,2015-07-28 11:00:00 -0400,2015-07-28 13:00:00 -0400,Master Elias Gedney,east,3508,Ships in the SCA Period: A Chronological Overview,Pennsic University,European,,false,A comprehensive overview of the development of ships in western Europe between 600 and 1600.,A comprehensive overview of the development of ships in western Europe between 600 and 1600.,2.0,"",,,,,2,2015-04-06 17:30:13 -0400
3115,A&S 2,2015-07-28 11:00:00 -0400,2015-07-28 12:00:00 -0400,Lord Alaxandr,east,4510,HS Summer Math Help and Challenge Problems,Pennsic University,"",,false,"Teenagers (and others)! Do you have summer math work? Algebra through AP calculus. Get some help, help one another, or try the challenge problems.","Teenagers (and others)! Do you have summer math work? Algebra through AP calculus. Get some help, help one another, or try the challenge problems. Don't make your parents have to remind you to open the book you carried to Pennsic. ;-)

",1.0,"",,,,,3,2015-05-08 19:43:53 -0400
3002,A&S 3,2015-07-28 11:00:00 -0400,2015-07-28 12:00:00 -0400,THL Arianwen o Wyndham,middle,4361,Medieval Papercutting,Pennsic University,Multiple Cultures,,true,History and technique of decorative papercutting from 6th-century China to 15th-century Germany.,"",1.0,Covers cost of printing handouts.,1.0,20,,,2,2015-05-01 19:29:15 -0400
3003,A&S 7,2015-07-28 11:00:00 -0400,2015-07-28 12:00:00 -0400,Lord Luca Sogliano,middle,4363,*Zibaldone da Canal*: The Book of a 14th-C Trader,Pennsic University,European,,false,"The daily life of a 14th-century man, geared towards the fun and insightful bits that animate. Also a great look at a contemporary view on Islam.","A look into the daily life of a 14th-century merchant named Canal, through diary and ledger, geared towards the fun and insightful bits that bring him to life. Watch him fail at learning algebra. Learn how he feels about Islam. You may never get a better look at the personal thoughts of someone who lived 600 years ago.",1.0,For the handout,1.0,20,,,2,2015-05-01 19:43:41 -0400
2606,A&S 8,2015-07-28 11:00:00 -0400,2015-07-28 11:30:00 -0400,Lady Jeneur le Geline,lochac,3825,The Market Wallet: A Form of Period Luggage,Pennsic University,European,,false,The market wallet is an alternative to the shoulder bag in use from Anglo-Saxon to 19th-C Europe. Construction and period evidence will be discussed.,"",0.5,N/A,,20,,20,2,2015-04-25 20:25:40 -0400
2673,A&S 11,2015-07-28 11:00:00 -0400,2015-07-28 13:00:00 -0400,Lady Angharad verch Glyndwr O Llang,middle,3977,Basic Bookbinding,Pennsic University,"",,false,"Basic binding of books, history, hands-on, practical application. Learn different stitches and page attachment; leave with a small bound book.","Basic binding of books, a bit of history, hands-on, and practical application. Participants will learn different types of stitching and page attachment, plus covers, and will leave with a small bound book and/or a girdlebook cover.",2.0,"Paper, leather, wax,thread, cloth, ",,,5.0,,2,2015-04-29 12:30:22 -0400
2976,A&S 12,2015-07-28 11:00:00 -0400,2015-07-28 12:00:00 -0400,THL Philippa Montague,middle,4351,Designing and Building a Pavilion,Pennsic University,European,,false,"An overview of pavilion styles, followed by detailed discussions of design considerations for several different styles.","This class will present an overview of medieval and Renaissance tent and pavilion styles, based on what we see in period portraits and in a few surviving examples. The presenters will discuss their experience in building a variety of pavilions. After the class period, students are welcome to visit several pavilions on-site to continue discussion of design details and challenges.",1.0,"",,15,,,2,2015-05-01 18:49:18 -0400
2603,Dance Tent,2015-07-28 11:00:00 -0400,2015-07-28 12:00:00 -0400,Lady Rebecca da Firenze,west,3854,*Gracca Amorosa* for Beginners,European Dance,European,,false,"Come learn *Gracca Amorosa*, one of the most popular 16th-C. *cascarde*. Dancers of all ages welcome. Prior dance experience helpful but not required.","",1.0,"",,,,,1,2015-05-07 11:49:37 -0400
3042,A&S 3,2015-07-28 12:00:00 -0400,2015-07-28 13:00:00 -0400,Viscountess Ísgerðr Gulkárr,middle,4435,Viking: The Next Step...,Pennsic University,European,,false,Taking your basic Viking/Norse to the next level. This class includes accessories and covers head to toe. Male and female. ,Taking your basic Viking/Norse to the next level. How to make small changes to polish your overall Norse look. This class includes accessories and covers head to toe. Male and female attire will be covered. This is not a sewing or persona-specific class.  ,1.0,"",,30,,,1,2015-05-04 07:55:07 -0400
2115,A&S 8,2015-07-28 12:00:00 -0400,2015-07-28 13:00:00 -0400,THL Vincenzo da Brescia,ealdormere,3103,The Medievalist Abroad: What to See in Italy,Pennsic University,European,,false,"A tourist itinerary of medieval attractions, based on extensive personal experience, starting with Venice, Florence, and Rome, and going on.","Medieval Italy is sadly neglected by tourism bureaus that emphasize classical and Renaissance attractions. This class will highlight some of Italy's many medieval glories, financed by a golden age of profiteering from the crusades and crusaders.",1.0,"",,30,,,1,2015-02-21 16:44:06 -0500
2436,Dance Tent,2015-07-28 12:00:00 -0400,2015-07-28 13:00:00 -0400,Duchess Branwyn ferch Gwythyr,æthelmearc,3592,European Sword Dancing,European Dance,European,,false,"An overview of hilt and point sword dances in period, and a chance to learn a more modern, though quite similar, version.","An overview of hilt and point sword dances in period, and a chance to learn a more modern, though quite similar, version.",1.0,"Handout. Materials are limited because I only have 12 ""swords"" to dance with.",1.0,25,,12,2,2015-05-11 13:42:06 -0400
2246,Livonia Smithery (170),2015-07-28 12:00:00 -0400,2015-07-28 13:00:00 -0400,Lord T W,æthelmearc,3447,Beginning *Repoussé* and Chasing,Pennsic University,"",,true,Hands-on class; will make a copper foil rose.,Hands-on class; will make a copper foil rose.,1.0,Hand out,5.0,12,,,8,2015-04-08 17:58:40 -0400
2943,Middle Eastern Tent,2015-07-28 12:30:00 -0400,2015-07-28 13:30:00 -0400,Mistress Scheherazade al-Zahira,east,4246,Middle Eastern Dancing for All Shapes and Sizes,Middle Eastern,Middle Eastern,,false,"If you love to shake your shimmy or want to try dancing for the first time, come out and join us.","",1.0,"",,,,,2,2015-05-04 18:27:44 -0400
2368,A&S 1,2015-07-28 13:00:00 -0400,2015-07-28 14:00:00 -0400,Mistress Safiya bint Suleiman,trimaris,3485,Indian Kutchwork / Marash Embroidery I,Pennsic University,Middle Eastern,,false,Basic interlaced herringbone stitch: a complex multi-step stitch used primarily in northern Indian and Armenian embroidery dating from the 13th C. ,Interlaced herringbone stitch is a complex multi-step stitch used primarily in northern Indian and Armenian embroidery dating from the 13th C. This class teaches the basics of layout and work from which more complex patterns can be built.,1.0,"Handout packet includes hoop, fabric, floss, needle, instruction, research CD",5.0,10,,10,1,2015-04-06 17:27:30 -0400
2656,A&S 5,2015-07-28 13:00:00 -0400,2015-07-28 15:00:00 -0400,THL Bojei Temur,middle,3970,Exchequer 101,Pennsic University,"",,false,"Were you told, “Just put expense A on line 15 – it’s easy!”? Have you ever been confused by SCA financial reports? Would you like to understand them?","",2.0,"",,15,,,2,2015-04-29 12:10:11 -0400
2278,A&S 7,2015-07-28 13:00:00 -0400,2015-07-28 14:00:00 -0400,Lady Faye de Trees,atlantia,3321,Are You Wearing a Tablecloth? Greek Clothing!,Pennsic University,"",,false,"Learn how to create Greek garb easily, accurately, and with style! Meet Greek style, form, and ideals for the easiest garb ever!","We all deal with hot weather in the summer. Learn how to do so easily, accurately, and with style! We will cover basic Greek style, form, and ideals, then go into fabrics, colors, trims, and accessories to create a great classical and cool look.",1.0,"",,30,,,2,2015-03-25 20:40:10 -0400
2288,A&S 8,2015-07-28 13:00:00 -0400,2015-07-28 14:00:00 -0400,Lady Maggie Rue,east,3331,Historical Uses of Poisons,Pennsic University,"",,false,A rundown of the weaponization of poisons in history garnered from various resources.,"A review of the weaponization of poisonous plants (and two rocks) as recorded in history. A summary garnered from various resources, the compilation paints a unique picture of warfare and weaponization techniques from several cultures.",1.0,"",,20,,,2,2015-03-26 07:20:43 -0400
