id,location,start_time,end_time,instructor,instructor_kingdom,instance_id,name,track,culture,topic_and_subtopic,adult_only,description_book,description_web,duration,fee_itemization,handout_fee,handout_limit,material_fee,material_limit,repeat_count,updated_at
2795,A&S 9,2015-08-05 09:00:00 -0400,2015-08-05 11:00:00 -0400,Master John Elys,east,4085,Medieval Music Notation: Intermediate,Performing Arts and Music,European,,false,"Ligatures and perfection, for those comfortable with the basic class. Bring melody instruments you play fluently.","For those already comfortable with long note values, unbarred music, *musica ficta*, and clefs other than treble and bass. We'll learn some more advanced stuff: ligatures for combinations of *breves* and *longas*, and the weird world of triple meter, where the same note-head can mean several different durations in the same piece depending on context. Bring melody instruments (recorder, harp, fiddle, lute, etc.) that you play fluently. Voice is OK if you have good pitch sense. If recorder, bring several sizes (e.g., SATB) if possible.

Each session will use different examples, so feel free to attend both and get extra reading practice!",2.0,photocopied handouts,3.0,,,,2,2015-05-03 20:47:48 -0400
2137,A&S 11,2015-08-05 09:00:00 -0400,2015-08-05 12:00:00 -0400,Cynthia du Pont,meridies,3134,"Small Silk Banner, 10"" x 10""",Pennsic University,European,,true,Learn how to make a small silk banner; handouts available plus material list if you wish to make more. Limit of 12 participants. Others may watch.,"Learn how to make a small silk banner using the Serti ('corral' the dye) style. There will be handouts, including a material list so you can make more banners/standards when you get home. Limit of 12 participants. Others may watch.",3.0,"",,12,,12,2,2015-02-22 10:11:10 -0500
2904,A&S 13,2015-08-05 09:00:00 -0400,2015-08-05 10:00:00 -0400,THL Meadhbh inghean ui Bhaoighill,æthelmearc,4212,Horses 101: So You Want to Buy a Horse,Pennsic University,"",,false,Thinking of joining the ranks of SCA equestrians? Here's the info you need to make smart decisions - before you bring home your horse.,"If you have been thinking of buying a horse to participate in SCA activities, but don't  know where to start, this class will give you some answers and help you make good decisions before you part with any money to buy your dream horse. ",1.0,"",,,,,1,2015-05-01 18:42:53 -0400
2838,A&S 14,2015-08-05 09:00:00 -0400,2015-08-05 16:30:00 -0400,Chirurgeon Instructor,"",4138,ASHI CPR Pro for the Professional Rescuer ,First Aid,"",,false,Designed for individuals in the healthcare or professional rescuer field who are required to have a professional-level basic life support training. ,"CPR Pro for the Professional Rescuer program is designed for individuals in the healthcare or professional rescuer field who are required to have a professional-level basic life support training. Students learn how to recognize a life-threatening emergency, how to provide basic life support and what to do in case of an airway obstruction or choking. ASHI's CPR Pro for the Professional Rescuer has been approved for training for Emergency Medical Services personnel and is accepted by the National Registry of Emergency Medical Technicians (NREMT). Class length: 7 hours. Cost is $15 for card only, $20 including books.",7.5,Separate fee for certification card or course materials.,,,,,3,2015-04-30 22:36:10 -0400
2778,Battlefield,2015-08-05 09:00:00 -0400,2015-08-05 11:00:00 -0400,Master Robyn Solarius,middle,4064,Brass Band: Drop-In Playing,Performing Arts and Music,European,,false,Sackbut and cornetto drop-in playing. Tired of all of those crazy loud double reeds? Enjoy some sublime brass-only ensemble playing. Bring your chair.,Sackbut and cornetto drop-in playing. Tired of all of those crazy loud double reeds? Enjoy some sublime brass-only ensemble playing. High pitch sackbuts (alto) especially welcome. Bring music if you have any you would like to try.... Bring a chair.,2.0,"",,,,,2,2015-04-30 20:46:04 -0400
3101,Dance Tent,2015-08-05 09:00:00 -0400,2015-08-05 10:00:00 -0400,THL James Blackcloak,ealdormere,4491,Children's Dance: English Country,European Dance,European,,false,Bring your children for fun and easy English Country Dances suitable for all ages! (Any youth in attendance require a responsible adult present.),"",1.0,"",,,,,1,2015-05-07 20:44:26 -0400
3172,General Archery,2015-08-05 09:00:00 -0400,2015-08-05 10:00:00 -0400,Master Godric of Hamtun,east,4588,"THLord Merlin ""Memorial Plaque"" Dedication",Archery,"",,false,"The placement and dedication of the memorial plaque for THLord Ambrosius filius Merlinus ""Merlin"" at the Archery Range.","Please join us for the dedication and placement of the memorial plaque for THLord Ambrosius filus Merlinus ""Merlin at the archery range before the start of Pennsic Champions Archery Shoot.",1.0,"",,,,,1,2015-05-27 19:07:57 -0400
2959,Great Hall,2015-08-05 09:00:00 -0400,2015-08-05 11:00:00 -0400,Lady Porcia Vera of Vito's Minions,middle,4250,Female Fighter Meet Up,Event,"",,false,"For female fighters of all persuasions (heavy, rapier, combat archery/siege); any females interested; teachers to meet and discuss the female fighter.","The female fighter was initially not allowed in our Society and as it has become more common, both in participation and interest, we have set up a meeting for female fighters of all persuasions (heavy, rapier, combat archery/siege). This is not exclusionary however - females interested in fighting, their spouses/significant others, and those interested in teaching the female fighter are welcome to attend.

While there is no rigid format for this meeting, we hope that we will have constructive discussions about training, mind-set, philosophy, combat, etc., so that we can all walk away with something to take back home and apply in our area.

No cap on attendance - all are welcome. This is why the Great Hall was selected for this meeting.",2.0,"",,,,,1,2015-05-06 19:50:24 -0400
2877,Green List,2015-08-05 09:00:00 -0400,2015-08-05 17:00:00 -0400,Master Maximilian der Zauberer,middle,4520,Known World Baronial Combat Champions' Tourney,Martial Activities,"",,false,"Open to all Baronial adult and youth, armored and rapier champions. **Check list field announcement boards for final schedule.","A day to celebrate the Baronial Combat Champions of the Known World. Landed Barons and Baronesses are encouraged to bring their chairs and portable pavilions to help us choose the Pennsic 44 Baronial champions' champion. Open to all Baronial adult and youth, Armored and Rapier champions. **Check list field announcement boards for final schedule.",8.0,"",,,,,2,2015-05-18 18:40:49 -0400
2816,Middle Eastern Tent,2015-08-05 09:00:00 -0400,2015-08-05 10:00:00 -0400,Lady Jahanara,drachenwald,4110,Dancer's Pampering Toolkit,Middle Eastern,Middle Eastern,,false,Learn how pamper ourselves to reduce the chance of injury after Middle Eastern dance. Please bring a yoga mat and a tennis ball.,Learn how pamper ourselves to reduce the chance of injury after dance. We will be looking at massage and release techniques that help with common Middle Eastern dancer injuries. Please bring a yoga mat and a tennis ball.,1.0,"",,,,,1,2015-05-04 19:33:34 -0400
3118,Rapier List 1,2015-08-05 09:00:00 -0400,2015-08-05 11:00:00 -0400,THL Don Po Silvertop the Rogue,æthelmearc,4505,Æthelmearc Rapier Novice Tourney,Rapier Activities,"",,false,For novices less than three years from first rapier authorization; have never received a Kingdom-level rapier award or won a published-event tourney.,"This tournament is open to any authorized rapier combatant with less than three years from their first rapier authorization, who has never received an award at the Kingdom level for rapier prowess and who has never won a rapier tourney at a published SCA event. The tourney will be run as a multiple-bearpit tourney. Prizes will be awarded.

Note: This tournament will take place on the main battlefield near the rapier field",2.0,"",,,,,1,2015-05-13 14:01:10 -0400
2171,Rapier List 2,2015-08-05 09:00:00 -0400,2015-08-05 11:00:00 -0400,THL Philipp Reimer von Wolfenbütte,middle,3182,Fight Like You Mean It: Cut and Thrust Tourney,Rapier Activities,"",,true,This C&T tourney uses the period-accurate after-blow convention to force combatants to display clean technique and sound defense.,"Intended to showcase mastery of the art of defense, this Cut & Thrust tourney uses a convention dating back to the 15th century called the after-blow to ensure sound defensive technique. Here's how it works. After one fencer has landed a strike, their opponent has the span of a single action consisting of a step and a strike to retaliate. If he or she lands this after-blow, then the point is invalidated. Conversely, doubles will count as a loss for both fencers. The tourney is double elimination, best of three, and will be actively marshaled/adjudicated.",2.0,"",,,,,1,2015-05-13 14:14:04 -0400
2877,Red List,2015-08-05 09:00:00 -0400,2015-08-05 17:00:00 -0400,Master Maximilian der Zauberer,middle,4186,Known World Baronial Combat Champions' Tourney,Martial Activities,"",,false,"Open to all Baronial adult and youth, armored and rapier champions. **Check list field announcement boards for final schedule.","A day to celebrate the Baronial Combat Champions of the Known World. Landed Barons and Baronesses are encouraged to bring their chairs and portable pavilions to help us choose the Pennsic 44 Baronial champions' champion. Open to all Baronial adult and youth, Armored and Rapier champions. **Check list field announcement boards for final schedule.",8.0,"",,,,,2,2015-05-18 18:40:49 -0400
2928,Æthelmearc Royal (N04),2015-08-05 09:30:00 -0400,2015-08-05 11:30:00 -0400,THL Desiderata Drake,æthelmearc,4290,Known World Chatelaines Meeting,Pennsic University,"",,true,"Are you a Chatelaine or Hospitaller? Come meet and talk to Chatelaines from other kingdoms to discuss issues, get ideas, and receive support. ","Are you a Chatelaine or Hospitaller? Come meet and talk to Chatelaines from other kingdoms to discuss issues, get ideas, and receive support. ",2.0,"",,,,,1,2015-05-29 21:18:55 -0400
2707,Æthelmearc 1,2015-08-05 10:00:00 -0400,2015-08-05 12:00:00 -0400,THL Zofia Kowalewska,æthelmearc,3931,Beginning Scribal Track,Æthelmearc Scribal,Multiple Cultures,,false,"Four-day scribal arts beginner track. Topics Include layout, calligraphy and painting. Must attend all 4 days. Kit provided. No experience necessary.","If you ever wanted to try the scribal arts, now is your chance. The Scribal Beginner Track will introduce you to the tools of the trade, design elements, layout, outlining, painting and calligraphy. We'll create a scroll from beginning to end. No experience necessary and a beginner kit is included with the class cost.  ",2.0,Cost of beginning scribal kit.,,,10.0,10,4,2015-04-30 19:36:12 -0400
2413,Æthelmearc 2,2015-08-05 10:00:00 -0400,2015-08-05 11:00:00 -0400,Lady Sajah bint-Habushun,atlantia,3560,Taking the Pain Out of Period Pigments,Æthelmearc Scribal,Multiple Cultures,,false,Basic period pigments and problems/solutions mixing and using them. Studio time for practice.,This is a discussion of the nature of period pigments and problems/solutions mixing them with binders and using them to illuminate. It is participatory with studio time to use the materials discussed.,1.0,$10 for handout and use of period pigments/scroll quality papers,2.0,50,8.0,,2,2015-04-30 20:12:34 -0400
2253,Æthelmearc Royal - Food Lab (N04),2015-08-05 10:00:00 -0400,2015-08-05 15:00:00 -0400,Baron Janos Meszaros,æthelmearc,3286,Pennsic Food Lab,Cooking Lab,Multiple Cultures,,false,"Primitive and medieval cooking space will be made available while open discussion, demonstrations and classes will be taught on applied archaeology.","Primitive and medieval cooking space will be made available while open discussion, demonstrations and classes will be taught on applied archaeology relating to food and its production. Medieval cooking techniques, technology and methodology will be showcased in this open forum. All skill sets welcome.",5.0,Handout fees may vary. A requested donation tin will be available to help defray the cost of equipment and materials.,,,,,1,2015-03-25 12:52:50 -0400
3098,Æthelmearc Royal (N04),2015-08-05 10:00:00 -0400,2015-08-05 17:00:00 -0400,Pennsic Performing Arts,"",4484,Arts and Science Competition at Æthelmearc Royal,Event,"",,false,Arts and Science Competition at Æthelmearc Royal.,Arts and Science Competition at Æthelmearc Royal.,7.0,"",,,,,1,2015-05-07 20:41:26 -0400
2173,Amphitheater,2015-08-05 10:00:00 -0400,2015-08-05 11:00:00 -0400,Lady Noelle de la Plume,middle,3192,Fool School,Performing Arts and Music,Other,,false,Are you a fool or a fool wannabe? Come to Fool School to share and learn. Prepare a 5-minute skit to perform. All ages/experience levels welcome.,"Are you a fool or a fool wannabe? Come to Fool School to share and learn. Fools/performers of all types and experience levels are welcome. Jugglers, magicians, singers, freaks and geeks. Get help creating or honing a skit of no more than 5 minutes to perform in the Amphitheater Wednesday 8/6 6-7 pm.
You might even become a “Licensed Fool.” Performing is not mandatory.",1.0,"",,,,,9,2015-05-04 22:26:09 -0400
2715,A&S 3,2015-08-05 10:00:00 -0400,2015-08-05 11:00:00 -0400,Lady Fiona the PRepared,æthelmearc,4003,Hounds Abound!,Pennsic University,"",,false,Interested in how hounds were kept? What were the different types of hounds? What is coursing? Come learn about all things canine!,"Come learn about hounds in the Middle Ages! We'll be looking at different types of hounds, how they were cared for, how they were hunted and how they fit into everyday life.",1.0,"",,,,,2,2015-04-29 13:39:33 -0400
3082,A&S 5,2015-08-05 10:00:00 -0400,2015-08-05 11:00:00 -0400,Lady Nadyezhda the Simple,middle,4461,Spindlelicious,Pennsic University,Multiple Cultures,,false,Take a tour of the Known World through drop spindle design. Learn why they work and bring your own to test for balance.,"",1.0,"",,25,,,1,2015-05-05 19:05:07 -0400
2150,A&S 7,2015-08-05 10:00:00 -0400,2015-08-05 12:00:00 -0400,Mistress Sigrid Briansdotter,atlantia,3158,The Lengberg Bras: Current Research and Roundtable,Pennsic University,European,,false,Current research on 15th-century bras found in Lengberg Castle in Austria; discuss what it tells us about construction methods. Bring yours to show.,Current research on the 15th-century bras found in the Lengberg Castle in Austria;  discuss what it can tell us about construction methods. Bring your experiments for the roundtable portion. We'd love to see how people have tackled this garment.,2.0,Handout contains color photos and research details.,10.0,25,,,2,2015-02-23 18:18:58 -0500
2497,A&S 12,2015-08-05 10:00:00 -0400,2015-08-05 11:00:00 -0400,Mistress Shishido Tora Gozen,æthelmearc,3704,Equestrians! Improve/Enhance Your Period Look,Pennsic University,Multiple Cultures,,false,"Class focuses on ways to improve or enhance your period appearance, including riding clothes, coverings and tack, and heraldry.","This class will focus on ways to improve or enhance your period appearance, including making and using persona appropriate riding clothes, coverings and tack for your horse, and using heraldry. Safety issues will be discussed as well. ",1.0,"",,,,,1,2015-04-18 11:31:45 -0400
2770,A&S 13,2015-08-05 10:00:00 -0400,2015-08-05 13:00:00 -0400,Lord Vincenzo Martino Mazza,east,4058,"Machines, Technology and Change",Pennsic University,European,,false,"Technology survey: Classical Greek through medieval. Construction, ship building, power (horse, water, wind), clocks, education, etc.
","",3.0,"20 page handout
",1.0,30,,,1,2015-04-30 21:11:42 -0400
2637,Dance Tent,2015-08-05 10:00:00 -0400,2015-08-05 12:00:00 -0400,THL Henry of Maldon,æthelmearc,3883,English Country Dances: Miscellaneous,European Dance,European,,false,"All dances reconstructed by the teacher from Playford and/or Sloane; may include *Parsons Farewell, Nonesuch, Whirligig, Lady Cullen*.","All dances reconstructed by the teacher from Playford and/or Sloane; may include *Parsons Farewell, Nonesuch, Whirligig, Lady Cullen*.",2.0,"",,,,,1,2015-05-07 12:38:34 -0400
2476,Fort,2015-08-05 10:00:00 -0400,2015-08-05 12:00:00 -0400,Sir Crispin dela Rochefoucauld,middle,3636, Crusader Versus Saracen Battle,Martial Activities,Multiple Cultures,,false,God wills it! Scenarios to re-enact battles from the time of the Crusades. ,"God Wills it! Scenarios to re-enact battles from the time of the Crusades. Participants are required to only use arms and armor documentable to the time period of 1096-1291. Allowed Weapons: Any documentable to 1096-1291, subject to approval (swords, maces, axes, dagger, spear, thrown weapons, archery, siege, etc.). Allowed shields: round, kites, and heaters (and any other documentable style from the period). Armor and helms from the period are required. Bring your banners for pageantry. Properly attired support people are most welcome!",2.0,"",,,,,1,2015-04-18 14:17:10 -0400
2966,Games Tent,2015-08-05 10:00:00 -0400,2015-08-05 11:00:00 -0400,THL Louis Xavier de Navarre,middle,4253,*Tafl* Games,Games,"",,false,"The *Tafl* family of games were played through the Norse lands. The rules are simple and easy to learn, and the game play can be quick or complex.","The *Tafl* family of games were played through the Norse lands. The rules are simple and easy to learn, and the game play can be quick or complex.",1.0,"",,,,,2,2015-05-07 18:43:45 -0400
2481,Minerva's Spindle  (158),2015-08-05 10:00:00 -0400,2015-08-05 11:00:00 -0400,Mistress Gabrielle d'Auvergne,æthelmearc,3673,Storytelling Academy,Performing Arts and Music,Multiple Cultures,,false,"Explore genres, tools, styles, and uses of storytelling. Cultural and medieval approaches, applications, performance coaching. New topics each day.","During this nine-day academy, students will gain knowledge about the history and techniques for storytelling both in the SCA and the modern world. Students may attend individual sessions or all of the academy. There will be guest teachers and time for students to practice and receive feedback. The academy will culminate in a student performance. No classes are repeated. The focus is on comfort, nurturing, and honing skills within the students’ capabilities. All levels are welcome. Students may pick up a class outline at the academy space, Minerva’s Spindle 158, where classes will also be listed on the message board. Seating is limited; feel free to bring your own chair.",1.0,"",,,,,9,2015-04-25 18:48:47 -0400
3193,"PA Tent, Backstage (St. Lily's Commons (in University))",2015-08-05 10:00:00 -0400,2015-08-05 12:00:00 -0400,Lady Carowyn Silveroak,east,4617,On Being a Prop Person,Performing Arts and Music,"",,false,Have you ever wanted to work behind the scenes of the theater? Come and learn all the hats a prop person wears!  Meet backstage of the PA Tent.,"Have you ever wanted to work behind the scenes of the theater? Come and learn all the hats a prop person wears: making, maintaining, tips, tricks, and pointers! Rehearsals for the Pennsic play *The Merchant of Venice* start at 8:30 am Mon-Thu at the Performing Arts Pavilion. Find the prop person and see how it's done! We'll keep it quiet, since this is during rehearsals. Look for the lady with the light blue-and-white baldric. Meet backstage of the PA Tent.",2.0,0,,,,,3,2015-06-23 12:11:57 -0400
2332,Performing Arts Rehearsal Tent,2015-08-05 10:00:00 -0400,2015-08-05 12:00:00 -0400,Pennsic Performing Arts,"",3407,Pennsic Choir: Open Rehearsal,Performing Arts and Music,"",,false,The Pennsic Choir welcomes all interested singers! Songs in honor of the 500th anniversary of the Coronation of François I of France.,"The Pennsic Choir welcomes all interested singers! This year's concert features songs of the early to mid-16th century in honor of the 500th anniversary of the Coronation of François I of France. Singing in the Pennsic Choir is an intense and rewarding experience. We rehearse two hours each day for a week, then perform a concert on Thursday evening of War Week. The ability to read music and sight-sing is helpful, but not required if you learn the music in advance. Sheet music and audio tracks are available online now at https://sites.google.com/site/kwcpennsicchoir/home/pennsic-choir/pennsicxliiichoirs",2.0,"",,,,,7,2015-05-06 01:31:11 -0400
2918,Pine Box Traders (192),2015-08-05 10:00:00 -0400,2015-08-05 11:00:00 -0400,THL Egill the Loomwright,calontir,4271,Inkle Weaving Basics,Pennsic University,"",,false,"Using the continuous warping method, you will warp the loom and weave an inkle strip.","Using the continuous warping method, you will warp the loom and weave an inkle strip. Classroom loaner looms available or bring your own.",1.0,"weaving materials, string",,,3.0,,6,2015-05-01 19:18:33 -0400
2399,University Point,2015-08-05 10:00:00 -0400,2015-08-05 12:00:00 -0400,"Master Emrys Eustace, yclept Broom",æthelmearc,3558,Weed Walk ,Pennsic University,Other,,false,Wild plant identification. Wear walking shoes and hat; leave from Univ. Point. Different teachers on different days; walk with us more than once!,"Cooper's Lake abounds with medicinal and food plants that were used by various primitive and medieval cultures. Learn to identify them during a walk around the campsite. The walk will take place rain or shine. Please wear sturdy shoes and a hat. Meet at University Point for the start of the class. We have three wonderful new teachers this year, enabling us to offer this class more times!",2.0,"",,,,,11,2015-04-12 20:27:32 -0400
2500,Middle Eastern Tent,2015-08-05 10:30:00 -0400,2015-08-05 11:45:00 -0400,Lady Nina Amaya of Bright Hills,atlantia,3710,Kids' Dance: Veil choreography,Middle Eastern,Middle Eastern,,false,"Kids 7-100, with a smidgeon of coordination: Bring a dance veil that is longer than your arms' span. (Adult: 3 yds.) Bright, quick choreography.","Kids 7-100, with at least a smidgeon of coordination. Bring a dance veil that is  longer than your arms' span. (Adult: 3 yds.) Bright, quick choreography. Contact Nina Amaya ahead of Pennsic if you would like to borrow, buy or ask questions about an appropriate dance veil. www.NinaAmaya.com",1.25,"",,,,,1,2015-05-04 19:34:41 -0400
2407,Æthelmearc 2,2015-08-05 11:00:00 -0400,2015-08-05 12:00:00 -0400,Lady Sajah bint-Habushun,atlantia,4180,Creating Pigments - Period Style,Æthelmearc Scribal,Multiple Cultures,,false,How pigments were created in period plus modern alternatives and methods for creating a reasonable facsimile of a period palette.,"A brief discussion, using period and modern resources, about how pigments were created in period plus a discussion and demonstration of modern alternatives and methods for creating a reasonable facsimile of a period palette. Includes studio time to experiment with tools and materials as well as sample painting using the pigments.",1.0,$5 total for materials and handout,2.0,50,3.0,,2,2015-04-30 19:47:58 -0400
2313,Amphitheater,2015-08-05 11:00:00 -0400,2015-08-05 13:00:00 -0400,Pennsic Performing Arts,"",3368,Rehearsal (Closed): Pennsic *Commedia* All Stars,Performing Arts and Music,"",,false,Space in use.,Space in use.,2.0,"",,,,,6,2015-04-26 20:15:34 -0400
2373,A&S 1,2015-08-05 11:00:00 -0400,2015-08-05 13:00:00 -0400,Master Elias Gedney,east,3507,Mythbusting Period Piracy,Pennsic University,European,,false,The differences between period and non-period piratical portrayals will be outlined.,The differences between period and non-period piratical portrayals will be outlined. Common myths and mistakes about piracy in the SCA period will be highlighted.,2.0,"",,,,,2,2015-04-06 17:31:33 -0400
2694,A&S 3,2015-08-05 11:00:00 -0400,2015-08-05 12:30:00 -0400,Lady Miriam bat Pessah,middle,3988,"Kosher: Then, Now and in the Current Middle Ages",Pennsic University,Other,,false,"Jews live with religious limits on what they eat. Learn about how those practices have changed over time, and brainstorm keeping kosher in the SCA.","",1.5,"",,,,,1,2015-04-30 20:06:34 -0400
3015,A&S 4,2015-08-05 11:00:00 -0400,2015-08-05 13:00:00 -0400,THL Adrianna Stothard,meridies,4379,*Al-Murri*: Making It; Tasting It,Pennsic University,Middle Eastern,,false,Overview of the process used to make *al-murri al-naqi lil-maghariba* and *murri* as made by the Iraqis. Samples available for tasting.,"The process of making *al-murri* is both simple and fascinating. In this class we will review the process I use to make two types of this pre-13th century, Middle Eastern condiment. Taste and discuss samples of each, and begin a batch of *al-murri al-naqi lil-maghariba* (the infused 'soy' sauce of the North Africans). Students will be able to take an *al-murri* starter kit home with them for a small fee. ",2.0,"budhaj, herbs and other ingredients required to make your own *al-murri* at home",,25,,25,1,2015-05-03 13:47:28 -0400
2788,A&S 5,2015-08-05 11:00:00 -0400,2015-08-05 12:00:00 -0400,Lady Rosina von Schaffhausen,east,4075,Measuring the Heavens and the Earth,Pennsic University,European,,false,"On Fibonacci's book *De Practica Geometrie*: measuring the dimensions, area, and volume of a number of physical objects on earth and in space.","In this class we will study *De Practica Geometrie* by Leonardo of Pisa, known today as Fibonacci. In this book Fibonacci explains how to use geometry for practical purposes, mainly on measuring the dimensions, areas, and volumes of physical objects such as fields, trees, and planets.",1.0,"",,35,,,2,2015-04-30 20:15:33 -0400
