id,location,start_time,end_time,instructor,instructor_kingdom,instance_id,name,track,culture,topic_and_subtopic,adult_only,description_book,description_web,duration,fee_itemization,handout_fee,handout_limit,material_fee,material_limit,repeat_count,updated_at
2537,A&S 10,2015-08-03 10:00:00 -0400,2015-08-03 12:00:00 -0400,Lady Mikalina Lydushka Pavlovna,east,3769,Peppers Are Not Just Corns,Pennsic University,Multiple Cultures,,true,You think that peppers are just peppercorns? Nope! We will cover peppers from peppercorn to vine fruit! And how to use them!,"You think that peppers are just peppercorns? Think twice! Think three times! We will cover peppers from peppercorn to vine fruit, the different histories and uses! Add some spice to your life and your food! Become informed and adventurous!",2.0,"2 for the handout, 3 for the food tasting and cooling foods and water.",2.0,30,3.0,30,1,2015-04-30 17:54:16 -0400
2876,A&S 14,2015-08-03 10:00:00 -0400,2015-08-03 11:00:00 -0400,Lord Jayme Hume of Berwyk,east,4184,So You Want to Make a Cloister Garden?,Pennsic University,European,,false,What is a cloister garden? Where were they? What was in them? How were they made and kept up? Q&A-type session.,"",1.0,"",,,,,1,2015-05-01 19:37:54 -0400
2895,A&S 15,2015-08-03 10:00:00 -0400,2015-08-03 11:00:00 -0400,Lady Ester Pickering,atlantia,4198,Fingerweaving: The Greene Dorge,Pennsic University,European,,false,Finger weaving was a technique used to make purse strings and lacings in the 16th century. Basic finger weaving experience required. ,Finger weaving was a technique used to make purse strings and lacings in the 16th century. There are dozens of patterns created by this technique involving one or more workers. This class will teach the Greene Dorge pattern that I used on my sweet bag. Basic finger weaving experience required. To see how the weave looks: http://traynedbandes.com/blog/2014/02/09/fingerloop-braiding-for-my-sweete-bag/,1.0,"Handouts are printed in color.
Kits are thread to practice the weave with a safety pin. ",2.0,20,1.0,12,1,2015-05-01 17:14:50 -0400
3142,Cabochons (Bow Street),2015-08-03 10:00:00 -0400,2015-08-03 11:30:00 -0400,Lady Arastorm ,east,4563,*RúnValdr*,Pennsic University,European,,false,"In period, runes were very rarely used for divination, but there are many examples of runes being used for magic. A modern system for rune magick.","In period, runes were very rarely used for divination, but there are many examples of runes being used for magic. This is a system that shows, for example, how to use Norse or Anglo-Saxon runes to hear even at distance, or to awaken inanimate objects. This is a system of energy manipulation using runes and another set of symbols. This workshop introduces the symbols and what each of them is used for, and includes the attunement. It does *not* include introduction to runes. You may take this workshop without knowing the runes, but you will need to learn them to be able to use this system. You will be able to use this technique immediately. ",1.5,0,,15,,,4,2015-05-22 21:02:42 -0400
2917,Dance Tent,2015-08-03 10:00:00 -0400,2015-08-03 11:00:00 -0400,Mistress Felice Debbage,middle,4219,"Flash Mob Prep Class: *La Castellana, Petit Riens*",European Dance,European,,false,"Don't know the dances? Take this class to prepare! Mob is Tuesday, 8/4, noon, in grassy area near main gate.","Don't know the dances, *La Castellana* and *Petit Riens*? Want to be in a flash mob? Take this class to prepare. We will learn all the moves and practice how to start the flash mob so you'll look like a pro when we perform it for the lucky folks who happen to be strolling by. Musicians who can play the songs well are welcome, too! We will dance *La Castellana* first and then immediately jump into *Petit Riens.* Meet at noon on Tuesday, 8/4, in the wide, grassy south merchant area near the main gate for the flash mob. If you aren't able to join us for the rehearsal, then jump in on the dance during the first chorus of *La Castellana.* ",1.0,"One handout, front and back",0.25,,,,1,2015-05-07 12:36:44 -0400
2381,Fort,2015-08-03 10:00:00 -0400,2015-08-03 12:00:00 -0400,Countess Joleicia of Litchfield,ealdormere,3489,Armoured Castle Battle,Martial Activities,"",,false,"Two 30-minute unlimited resurrection battles. Sides switch after the first battle. Includes combat archery and siege.
","Two 30-minute unlimited resurrection battles. Sides switch after the first battle. One point per battle.
• Middle/East start on the west side of the field, Æthelmearc and allies start on the east side of the field.
• Field Layout: 
• 36'x36' tower 36' outside the gate, with an 18' doorway in both sides.
• 50' wall extending from tower south side to a 27' gap, then another 50' wall.
• Additional hay bales set up inside the castle on the east edge to mimic the actual fortifications on the west edge.
• Southern field edge will be 100' past the south flag.
• Edge of the world / start lines (east and west edges) and exact wall angle and placement will be determined by the DKEMs for Siege and Combat Archery to ensure a proper safety buffer.
• Resurrection occurs at the East and West edges of the world.
• Enemy troops may **not** move across the field and enter the castle from their opponents’ side from the south, though the main gate of the fort will be open for entering and exiting.
• Three banners; possession determined by the colored flag being raised above the 50% mark at time. Full gauntlets required to activate the flag.
• Banner #1 placed 50' past the end of the wall in the open field.
• Banner #2 in the center of the tower.
• Banner #3 in the center of the castle far enough in that it's not on the slope.
• One possession check at final cannon. Point awarded to side with majority possession.
• All holds will be local save in the event of a medical emergency. Only general holds will stop the clock.
• Combat archery and siege will be allowed in this battle. Gleaning of tubular and siege ammunition is allowed.
• Siege may move during the battle. Siege starting line will be determined on site.",2.0,"",,,,,1,2015-04-18 10:22:33 -0400
2662,Games Tent,2015-08-03 10:00:00 -0400,2015-08-03 11:00:00 -0400,Lord István Nyiregyhazi,east,3905,*Alquerques*,Games,Middle Eastern,,false,Period game from the Middle East in the family of checkers-style games. We will teach the rules and the play.,"Period game from the Middle East in the family of checkers-style games. We will review what is known, the rules, and the play through some games to learn the basic strategies.",1.0,"",,10,,,1,2015-05-07 18:36:20 -0400
2224,General Archery,2015-08-03 10:00:00 -0400,2015-08-03 12:00:00 -0400,THL Graem de Cherbourg,ealdormere,3255,Raise Your Archery Game,Archery,Multiple Cultures,,false,"A quick tutorial on the fundamentals of hand bows, arrows and archery as a discipline followed by on-range tutorial on shooting technique.","A quick tutorial on the fundamentals of hand bows, arrows and archery as a discipline followed by on-range tutorial on shooting technique. First time shooters welcome.",2.0,"",,,,,1,2015-04-18 13:28:59 -0400
3008,"Good Friends Camp (N-01, usually on St. Lawrence)",2015-08-03 10:00:00 -0400,2015-08-03 14:30:00 -0400,Mistress Katarina Helene von Schoenborn,middle,4370,Coptic Sketch Book,Pennsic University,Middle Eastern,,true,New this year: Learn to build a Coptic sketch book with wood covers and exposed spine.,New this year: Students will build a Coptic sketch book with wood covers and exposed spine using techniques used in Egypt in the 4th century.,4.5,"Fee includes leather, wood boards, paper, linen thread, and a handout.",3.0,6,7.0,6,2,2015-05-01 21:13:43 -0400
2481,Minerva's Spindle  (158),2015-08-03 10:00:00 -0400,2015-08-03 11:00:00 -0400,Mistress Gabrielle d'Auvergne,æthelmearc,3671,Storytelling Academy,Performing Arts and Music,Multiple Cultures,,false,"Explore genres, tools, styles, and uses of storytelling. Cultural and medieval approaches, applications, performance coaching. New topics each day.","During this nine-day academy, students will gain knowledge about the history and techniques for storytelling both in the SCA and the modern world. Students may attend individual sessions or all of the academy. There will be guest teachers and time for students to practice and receive feedback. The academy will culminate in a student performance. No classes are repeated. The focus is on comfort, nurturing, and honing skills within the students’ capabilities. All levels are welcome. Students may pick up a class outline at the academy space, Minerva’s Spindle 158, where classes will also be listed on the message board. Seating is limited; feel free to bring your own chair.",1.0,"",,,,,9,2015-04-25 18:48:47 -0400
3193,"PA Tent, Backstage (St. Lily's Commons (in University))",2015-08-03 10:00:00 -0400,2015-08-03 12:00:00 -0400,Lady Carowyn Silveroak,east,4619,On Being a Prop Person,Performing Arts and Music,"",,false,Have you ever wanted to work behind the scenes of the theater? Come and learn all the hats a prop person wears!  Meet backstage of the PA Tent.,"Have you ever wanted to work behind the scenes of the theater? Come and learn all the hats a prop person wears: making, maintaining, tips, tricks, and pointers! Rehearsals for the Pennsic play *The Merchant of Venice* start at 8:30 am Mon-Thu at the Performing Arts Pavilion. Find the prop person and see how it's done! We'll keep it quiet, since this is during rehearsals. Look for the lady with the light blue-and-white baldric. Meet backstage of the PA Tent.",2.0,0,,,,,3,2015-06-23 12:11:57 -0400
2332,Performing Arts Rehearsal Tent,2015-08-03 10:00:00 -0400,2015-08-03 12:00:00 -0400,Pennsic Performing Arts,"",3405,Pennsic Choir: Open Rehearsal,Performing Arts and Music,"",,false,The Pennsic Choir welcomes all interested singers! Songs in honor of the 500th anniversary of the Coronation of François I of France.,"The Pennsic Choir welcomes all interested singers! This year's concert features songs of the early to mid-16th century in honor of the 500th anniversary of the Coronation of François I of France. Singing in the Pennsic Choir is an intense and rewarding experience. We rehearse two hours each day for a week, then perform a concert on Thursday evening of War Week. The ability to read music and sight-sing is helpful, but not required if you learn the music in advance. Sheet music and audio tracks are available online now at https://sites.google.com/site/kwcpennsicchoir/home/pennsic-choir/pennsicxliiichoirs",2.0,"",,,,,7,2015-05-06 01:31:11 -0400
2399,University Point,2015-08-03 10:00:00 -0400,2015-08-03 12:00:00 -0400,"Master Emrys Eustace, yclept Broom",æthelmearc,3525,Weed Walk ,Pennsic University,Other,,false,Wild plant identification. Wear walking shoes and hat; leave from Univ. Point. Different teachers on different days; walk with us more than once!,"Cooper's Lake abounds with medicinal and food plants that were used by various primitive and medieval cultures. Learn to identify them during a walk around the campsite. The walk will take place rain or shine. Please wear sturdy shoes and a hat. Meet at University Point for the start of the class. We have three wonderful new teachers this year, enabling us to offer this class more times!",2.0,"",,,,,11,2015-04-12 20:27:32 -0400
2103,Family Range,2015-08-03 10:30:00 -0400,2015-08-03 11:30:00 -0400,Lord Naran Numuchi,atlantia,3083,Thumb Ring Archery,Archery,Other,,true,"Learn how to shoot like a Mongol. Requires a horse bow and arrows at least 4"" longer than your finger draw. Some rings will be available for sale.  ","Learn to shoot the way Mongols and other steppes and horse archers did. Lord Naran Numuchi, Bow Khan of the Great Dark Horde, Companion of the Order of the Yew Bow (Atlantia) and Ponte Alto Baronial Marshal and Archery Champion, has been shooting thumb ring since 1998, and has focused on the use and history of static-eared recurve bows the whole time.",1.0,"",,,,,2,2015-05-28 00:03:22 -0400
2108,Middle Eastern Tent,2015-08-03 10:30:00 -0400,2015-08-03 12:00:00 -0400,Ziggy,atlantia,3091,Beginning Drumming,Middle Eastern,Middle Eastern,,false,The basic rhythms used most often in drum circles and music within the SCA. A 4-part class that teaches different rhythms each day. BYO drum.,"Learn the basic rhythms used most often in drum circles and music within the SCA. This is a 4-part class that teaches different rhythms each day. BYO Drum.
Day 1- *Saidi, Beladi, Maqsum*
Day 2- *Chiftitelli, Masmoudi*
Day 3- *Ayub, Malfouf*
Day 4- *Kashlimah* and other strange stuff
",1.5,"",,,,,4,2015-05-01 13:03:04 -0400
2997,Æthelmearc 2,2015-08-03 11:00:00 -0400,2015-08-03 12:00:00 -0400,Lady Daniela Schwartzhaupt,atlantia,4345,Gilding the Scroll,Æthelmearc Scribal,Multiple Cultures,,false,Hands-on class. Students will learn quick and inexpensive ways to create a gilded border using patent metal-leafing materials.,"Ever get a scroll assignment that you needed to get done quickly and still wanted it to look special or wanted to make something shine when held up in court? In this hands-on class, students will learn a quick and inexpensive way to create an illuminated border using patent metal-leafing materials that can be obtained at a local arts and crafts store. Students will leave the class with an illuminated note card.",1.0,"$2 handout fee
$10 kit fee for students to use in class and take away a starter gilding set.",2.0,20,10.0,10,1,2015-05-29 21:17:51 -0400
2313,Amphitheater,2015-08-03 11:00:00 -0400,2015-08-03 13:00:00 -0400,Pennsic Performing Arts,"",3366,Rehearsal (Closed): Pennsic *Commedia* All Stars,Performing Arts and Music,"",,false,Space in use.,Space in use.,2.0,"",,,,,6,2015-04-26 20:15:34 -0400
2516,Archery,2015-08-03 11:00:00 -0400,2015-08-03 17:00:00 -0400,Master Godric of Hamtun,east,3735,Archery Populace War Point,Archery,"",,false,Archery Populace War Point,"All archers young and old are encouraged to come and lend their support to their kingdom's efforts, and to display their skill at archery. There will be three challenging populace shoots to test skills. Each Kingdom will be competing to earn the three War Points for each shoot. ",6.0,"",,,,,5,2015-06-18 08:13:03 -0400
2456,A&S 1,2015-08-03 11:00:00 -0400,2015-08-03 12:00:00 -0400,Sir Bedawyr of Avaricum,atlantia,3660,The Bayeux Tapestry,Pennsic University,European,,false,"This class will touch on all aspects of the tapestry. History, construction and hints to show how anyone can do a tapestry. ","This class will touch on all aspects of the tapestry. History, construction and hints to show how anyone can do a tapestry or a small piece of it.",1.0,"",,20,,,2,2015-04-18 11:51:45 -0400
2594,A&S 5,2015-08-03 11:00:00 -0400,2015-08-03 12:00:00 -0400,Masarrah bint Ma'mun,atlantia,3814,How Napoleon Led to the SCA,Pennsic University,European,,false,"Discusses the origin of our interest in the Middle Ages in the politics and culture of the 19th century, and traces their development to the present.","""Medievalism"" is the word historians use to describe a long-running cultural fascination with the Middle Ages as it has developed in modern Western culture.  This class will locate the initial development of medievalism with the politics and culture of the early nineteenth century -- and specifically, the failures of Napoleon -- and trace it as an historical phenomenon through the rise of nationalism, the World Wars, and up to the present day.",1.0,"",,30,,,1,2015-04-25 20:18:48 -0400
2857,A&S 7,2015-08-03 11:00:00 -0400,2015-08-03 12:00:00 -0400,Lady Dagmaer Hroaldsdottir,atlantia,4164,Drop Spinning 101,Pennsic University,"",,false,Learn the basics of how to spin using a drop spindle. Limited number of spindles available for use. Bring your own if desired. ,Learn the basics of how to spin wool using a drop spindle. Limited number of spindles available for use. $7 for supplies. Feel free to bring your own supplies if desired. ,1.0,"$5 spindle, $2 wool roving",,,7.0,10,1,2015-05-01 01:44:16 -0400
2113,A&S 8,2015-08-03 11:00:00 -0400,2015-08-03 12:00:00 -0400,Mistress Thorkatla Herjolfsdottir,meridies,3100,"Spaces, Architecture, and Western City Planning",Pennsic University,European,,false,"A discussion of city development in the medieval period, including building designs, locations, spaces, and the rise of Western cities.","",1.0,"",,,,,1,2015-02-21 16:42:02 -0500
2774,A&S 9,2015-08-03 11:00:00 -0400,2015-08-03 12:00:00 -0400,THL Lucia Elena Braganza,middle,4024,Pulling the Teeth out of Stage Fright,Performing Arts and Music,"",,false,"We'll pin down this ugly-muggly monster, dissect some elements of anxiety, wrestle common buggaboos, and practice some spook-busting techniques.","The vast majority of us experience **some** level of stage fright or performance anxiety, whether it's in a bardic space, or the CEO's office. We'll pin down this ugly-muggly monster, dissect some of the elements of anxiety, wrestle our most common buggaboos into the daylight, and practice some spook-busting techniques.  Focused on Bardic Arts, but applicable to all performances.",1.0,"",,15,,,1,2015-05-04 23:52:08 -0400
2292,A&S 11,2015-08-03 11:00:00 -0400,2015-08-03 12:00:00 -0400,Lady Judith bas Rabbi Mendel,east,3337,Passover Foods for a Medieval Seder,Pennsic University,European,,false,Covers the foods eaten at Ashkenazi Passover seders in the Middle Ages. We'll taste a number of these foods.,"This class will cover the foods eaten at Passover seders in the Middle Ages when matzah was an inch thick and horseradish was only eaten as an ingredient in charoset. We will be looking at the evolution of the rulings about various foods, recipes to make some of them, how some of the practices changed. Includes taste testing. ",1.0,to cover cost of handout and foods we taste test.,,,,,1,2015-03-26 18:47:05 -0400
2621,A&S 12,2015-08-03 11:00:00 -0400,2015-08-03 13:00:00 -0400,Dr Henry Best,middle,3867,"Divination: Sorcery, Casting of Lots, Tarot",Pennsic University,"",,false,"Divination by Sortilege, interpretation of randomized symbols, such as *i Ching*, runes, tarot, dice, bibliomancy. Second hour: in-depth cards, tarot.","Intro to Sorcery aka Sortilege, or interpretation of randomized symbols, such as *i Ching*, runes, tarot, bibliomancy. We will cover everything from flipping a coin to the Church practice of using dice to obtain answers directly from God. Second hour we will focus on cards, including tarot.",2.0,"",,,,,1,2015-05-06 07:25:43 -0400
2853,A&S 13,2015-08-03 11:00:00 -0400,2015-08-03 12:00:00 -0400,Mistress Catriona nicHugh Mclaey,middle,4155,The Historical Dangerous Beauty,Pennsic University,European,,false,"General information on the Venetian courtesan. A closer look at Veronica Franco, whose life was the basis for the 1996 movie, 'Dangerous Beauty.'","After a discussion on general information on the life of the Venetian courtesan, there will be a closer look at Veronica Franco, whose life as a highly sought-after courtesan was the basis for the 1996 movie, 'Dangerous Beauty.'",1.0,"",,,,,1,2015-04-30 21:36:26 -0400
2878,A&S 14,2015-08-03 11:00:00 -0400,2015-08-03 12:00:00 -0400,Lord Jayme Hume of Berwyk,east,4185,Medieval Gardens,Pennsic University,European,,false,"Kitchen gardens, medicinal gardens, cloister gardens, palace gardens. What were they, where were they, and what was in them?","",1.0,"",,,,,1,2015-05-01 19:28:16 -0400
2533,A&S 15,2015-08-03 11:00:00 -0400,2015-08-03 12:00:00 -0400,THL Desiderata Drake,æthelmearc,3765,Recruitment Roundtable,Pennsic University,"",,false,How do we get new people interested in the SCA? What works? What doesn't work? Come discuss recruitment strategies.,"How do we get new people interested in the SCA? What works? What doesn't work? Come discuss recruitment strategies including demos, social media, and other means of outreach. ",1.0,"",,,,,1,2015-04-23 17:07:12 -0400
2842,Dance Tent,2015-08-03 11:00:00 -0400,2015-08-03 12:00:00 -0400,Master Lorenzo Petrucci,meridies,4146,Love Lost and Won: *Leoncello* and *Gelosia*,European Dance,European,,false,Learn two simple and elegant 15th-century Italian dances that chronicle stormy romances: *Leoncello* and *Gelosia*.,Learn two simple and elegant 15th-century Italian dances that chronicle stormy romances: *Leoncello* and *Gelosia*.,1.0,"",,,,,1,2015-05-07 11:54:07 -0400
3085,Encampment of Erica Paige (W10),2015-08-03 11:00:00 -0400,2015-08-03 12:00:00 -0400,Erica Paige,east,4471,Introduction to Spinning *Poi*,Pennsic University,Other,,false,Learn some of the basic *poi* movements and terminology necessary to get you started.,"In this one-hour workshop, you will learn some of the basic *poi* movements and terminology necessary to get you started. *Poi* spinning is a great low-impact workout that will help you to improve your coordination and give your fitness routine some ""flare""! $20 Material Fee includes your choice of Home of Poi - Sock Poi and a storage pouch. Handout with class review & contacts. Refreshments are also served. ",1.0,"$20.00 Material Fee covers handout, poi, and refreshments",,,20.0,,3,2015-05-06 13:48:04 -0400
2920,Pine Box Traders (192),2015-08-03 11:00:00 -0400,2015-08-03 12:00:00 -0400,THL Egill the Loomwright,calontir,4274,*Kumihimo* Basics,Pennsic University,"",,false,*Kumihimo*: cord braiding on a disk.,Kumihimo: cord braiding on a disk. Make a basic round cord. Disk and string provided; take your work home with you.,1.0,"Disk, bobbins, string",,,6.0,,5,2015-05-01 19:22:26 -0400
2422,Serenity Studio (208),2015-08-03 11:00:00 -0400,2015-08-03 12:00:00 -0400,Lady Christina Von Tannenbaum,middle,3579,Intro to 6-on-2 Chainmail,Pennsic University,Multiple Cultures,,false,This type of chainmail was prevalent in period across multiple cultures. All materials provided but bring two pairs of pliers. ,Intro class for 6-on-2 chainmail prevalent throughout period across multiple cultures. All materials necessary to complete class project provided but bring two pairs of standard box nose pliers if you have them. Tools are available for those who don't have them on a first-come first-served basis.,1.0,"Sufficient hand-turned & cut aluminum rings, 12ga 5/8 in diameter, to complete class project.",,,10.0,8,9,2015-04-13 23:23:33 -0400
2441,Touch The Earth,2015-08-03 11:00:00 -0400,2015-08-03 12:00:00 -0400,Baglama Brian,atlantia,3602,*Saz* Workshop,Middle Eastern,Middle Eastern,,false,Workshop for beginner and experienced *saz* players.,"Basic techniques and melodies for beginners. Traditional long-neck and short-neck playing techniques. Experienced *saz* players are encouraged to share insights, techniques, and more complex melodies.",1.0,"",,,,,4,2015-05-29 01:35:03 -0400
2709,Æthelmearc Royal (N04),2015-08-03 11:30:00 -0400,2015-08-03 13:30:00 -0400,Baroness Clarice Roan,æthelmearc,3997,Known World Celebration of Hats: A Hatter's Tea,Pennsic University,Multiple Cultures,,false,Hat enthusiasts of the KW are invited to join us for a tea-and-cookies reception. Wear your best creation!,Hat enthusiasts of the Known World are cordially invited to join Duchess Ilish O'Donovan and Baroness Clarice Roan for a tea-and-cookies-reception. Wear the hat creation you are most proud of and bring pictures of the rest. Share your ideas and creativity.,2.0,"",,,,,1,2015-04-30 20:06:14 -0400
2138,A&S 1,2015-08-03 12:00:00 -0400,2015-08-03 13:00:00 -0400,THL Kateline Eliot,middle,3135,"Sign Heraldry: What, How, and Why?",Pennsic University,"",,false,"An introduction to Silent/Sign Heraldry focusing on what we do, where we do it, and how to get started. (English/ASL provided if needed.)","The purpose of this class is to introduce individuals to Silent/Sign Heraldry including what we do and our role, where we provide services, and how to get started. We will discuss court etiquette as well as interacting with voice heralds and royalty. Some SCA-specific signs will be discussed and demonstrated. ",1.0,"",,,,,1,2015-04-06 15:26:43 -0400
2232,A&S 2,2015-08-03 12:00:00 -0400,2015-08-03 13:00:00 -0400,Lady Fiora Valori,meridies,3263,Device Design 101,Heraldry,"",,false,"Draw/design a device or badge for SCA submission including how to use the space, being clear and identifiable, plus resources for images. ","This class will give you the tools on how to create a device (or badge) for SCA submission. Learn how to draw/design elements so they fit the space best, are clear and identifiable, and what resources are available for images to use in designing a device or badge for submission. Heralds and non-heralds are welcome.",1.0,"",,,,,1,2015-03-24 13:59:16 -0400
2534,A&S 3,2015-08-03 12:00:00 -0400,2015-08-03 13:00:00 -0400,Master Suleiman ibn Da'ud ibn Sahl,outlands,3766,Cryptology in the Middle Ages,Pennsic University,"",,false,An examination of the history and use of cryptology in period including famous and obscure. Contest and hints will be given at the end.,"",1.0,"",,,,,1,2015-04-23 17:09:24 -0400
2611,A&S 5,2015-08-03 12:00:00 -0400,2015-08-03 13:00:00 -0400,Instructor Gin,æthelmearc,3858,Ninja: Truth from Shadows,Pennsic University,Far Eastern,,false,Dare you look into the shadows of history to find the truth? Come to discover both the legends and real history of Japan's famed assassins. New info!,Dare you look into the shadows of history to find the truth? Come to discuss and discover both legends and the real history of Japan's famed spies and assassins. This class will examine the romanticized image of the Ninja and discuss the actual history of the world's most famous spies.,1.0,"",,20,,,4,2015-04-26 14:17:14 -0400
