id,location,start_time,end_time,instructor,instructor_kingdom,instance_id,name,track,culture,topic_and_subtopic,adult_only,description_book,description_web,duration,fee_itemization,handout_fee,handout_limit,material_fee,material_limit,repeat_count,updated_at
2848,Middle Eastern Tent,2015-07-31 13:30:00 -0400,2015-07-31 14:30:00 -0400,Lady Crimson Kate McPhee,east,4157,Restorative Dance,Middle Eastern,Middle Eastern,,false,"For people who have undergone physical trauma, surgery, or other disabling event, this class will introduce gentle movement back into your life.","This is for anyone who is on a healing journey—any person who is recovering from cancer; has had a serious surgery or multiple reconstructive surgeries; women who have just given birth and/or have had rough childbirth/cesarean surgery; anyone who is suffering from an emotional and/or physical disconnect from her body as the result of debilitating illness.
Using the framework of Middle Eastern dance, we will gently introduce movement back into the lives of those who have suffered physical traumas that may prevent them from feeling both physically and emotionally comfortable in a traditional dance class. The class will consist of a gentle dance warm-up, gentle stretch, learning no more than two to three dance moves, slow and gentle cool-down stretch.",1.0,"",,,,,1,2015-05-04 18:24:46 -0400
2576,A&S 5,2015-07-31 14:00:00 -0400,2015-07-31 15:00:00 -0400,THL Roana Aldinoch,middle,3796,History of Hops,Pennsic University,European,,true,"Learn about the history of hops, where they grew, how they were used, and when they became a ""necessary"" ingredient in brewing. ","While hops are ubiquitous in modern beer brewing, that wasn't always the case. In fact, there were laws to prevent non-hop brewing pubsters from beating up hop-brewing pubsters in 15th-century England. Learn about the history of hops in Europe, where they grew, how they were used, and when they became a ""necessary"" ingredient in brewing. Hopless beer will be available for tasting for those 21 and older for $1.",1.0,Taste of homebrewed hopless beer,1.0,15,1.0,15,2,2015-04-25 20:18:22 -0400
2276,A&S 7,2015-07-31 14:00:00 -0400,2015-07-31 15:30:00 -0400,Lady Faye de Trees,atlantia,3323,Coaching and the Art of Constructive Criticism,Pennsic University,"",,false,Discover proven NPS Coaching techniques to cultivate critique that aids and inspires rather than crushing talent before it can bloom. Coach the dream!,We all hear the cries of the populace - or at least the artists-to-be and the volunteers-to-be - that they tried and were rendered low by sharp criticism. Here you can discover proven coaching techniques from a National Park Service Registered Coach. Learn to shape artistic performance and presentation or volunteer service into something that serves the dream rather than drives people away!,1.5,"",,30,,,1,2015-03-26 18:44:46 -0400
2242,A&S 8,2015-07-31 14:00:00 -0400,2015-07-31 15:00:00 -0400,Lord Tempus Peregrinator,ealdormere,3288,"Gussets, Godets and Gores “Oh My” 2",Pennsic University,"",,false,"A new class on gussets, godets and gores. With the keyhole neck class, this shows the easiest way to make a tunic, and more about sewing.","This is a new class on gussets, godets and gores. Combined with the keyhole neck class, this shows the easiest way to make a tunic, and more about sewing. How to cut and sew gussets, godets and gores, all devices to give your clothes better fit, more fullness and freedom of movement! We'll discuss how to cut and sew gussets, as found on the underarms of T-tunic, the fast and easy way. Also covers godets and gores, the difference and how easy they are, too. A lot of good advice about sewing in general.",1.0,"",,,,,1,2015-03-25 17:20:25 -0400
2196,A&S 9,2015-07-31 14:00:00 -0400,2015-07-31 15:00:00 -0400,Lord Drake Oranwood,east,3222,Songwriting to Tell a Story,Performing Arts and Music,"",,false,"Principles and guidelines for constructing tight, compelling, original SCA-appropriate songs that capture (and hold) an audience.","Principles and guidelines for constructing tight, compelling, original SCA-appropriate songs that capture (and hold) an audience. The focus is on lyrics, song and story structure. How is writing a good lyric different from writing a good poem? Create a singable story that is entertaining, engaging, and will hold the attention of a SCAdian audience (who enjoy period material, but still prefer a song that runs 5 minutes or under).",1.0,"",,,,,1,2015-04-29 21:58:12 -0400
2880,A&S 13,2015-07-31 14:00:00 -0400,2015-07-31 16:00:00 -0400,Baroness Gwenllyen the Minstrel,middle,4188,Book Lovers' Tea,Pennsic University,"",,false,Please bring your favorite book(s) to discuss. Books with medieval themes and topics are encouraged but not required. Be ready to take notes!,"Please bring your favorite book(s) to discuss. Books with medieval themes and topics are encouraged but not required. Bring paper and pencil to jot down new authors to check out. Iced tea, water and treats will be provided.  ",2.0,"",,,,,1,2015-04-30 22:38:12 -0400
2608,Barony of Roaring Wastes (N08),2015-07-31 14:00:00 -0400,2015-07-31 17:00:00 -0400,THL Catherine of deva,middle,3828,Bag Cheese 101,Pennsic University,"",,false,We will make a soft cheese. While it is draining we will talk about what you can do with this cheese and touch on making hard cheeses. ,"",3.0,"",,,,,1,2015-04-26 17:21:55 -0400
2999,Dance Tent,2015-07-31 14:00:00 -0400,2015-07-31 15:00:00 -0400,Mistress Briana Douglas,east,4336,Beginner Dance: Absolute Beginner A,European Dance,European,,false,Never danced before? This is the class for you! We’ll start from the very basics and soon you'll be on your way to the ball!,"Never danced before? This is the class for you! We’ll start from the very basics and soon you'll be on your way to the ball!
",1.0,"",,,,,2,2015-05-03 13:50:33 -0400
3058,Guild of Limners (Opposite the Big Cooper Store (Old Barn)),2015-07-31 14:00:00 -0400,2015-07-31 16:00:00 -0400,"Lord Aleksandr, a Chymist",east,4447,Got Them Copper Ink Blues or Greens?,Æthelmearc Scribal,Multiple Cultures,,false,"How to make true transparent copper-acetate inks, covering the spectrum from blue-black to bright green. Other inkmakers invited to join in.","Despite claims to the contrary by alleged 'experts', the period illuminator had access to inks ranging from dark blue to bright green, and all shades in between, using commonly available goods. Vinegar and copper or brass (and time and patience) make the powder that can become a true transparent ink, something that ""burns"" its way permanently into parchment, paper or papyrus. These may change color with time, but will last a good century or two.",2.0,"Some inks MAY be available for purchase, entirely OPTIONAL; samples free",,25,,50,2,2015-05-04 10:46:15 -0400
2087,Gunnery Point (Top of Mt Eislinn),2015-07-31 14:00:00 -0400,2015-07-31 16:00:00 -0400,Lord Erich von Kleinfeld,atlantia,3062,Period Black Powder Firearms: Safety and Handling,Pennsic University,European,,true,"Firearm safety, handling, and shooting procedures for small arms and artillery, 1320-1600. Powder and match supplied by teacher. Ages 18+.","Firearm safety, handling, and shooting procedures for small arms and artillery, 1320-1600. Owners of period arms are requested/encouraged to bring them and help with coaching newer shooters. Powder and match are supplied by instructor. Ages 18+. Handouts for all classes: http://www.3fgburner.net/#info.",2.0,"",,20,,,1,2015-05-20 20:43:19 -0400
2489,Performing Arts Tent,2015-07-31 14:00:00 -0400,2015-07-31 15:30:00 -0400,Pennsic Performing Arts,"",3677,Sing We And Chant It: Madrigal and *A Capella* Jam,Performing Arts and Music,"",,false,"Meet-and-greet optional practice session for audience participation, ""Sing We and Chant It"" Madrigal and *A Capella* Jam.","Meet-and-greet optional practice session for audience participation, ""Sing We and Chant It V"", Madrigal, Part Song, and A Capella Jam, Monday, 8/4, at 6:00 pm in the Performing Arts Tent. All are welcome to come and make joyful music! Music will be available to share, or bring your own! (Material fee optional for a folder of this year's jam music)
Hosts:  THL Lorelei Skye, Mistress Gianetta Andreini da Vicenza, Professor Pieter van Doorn
2015 current song list available here - please let us know if you have any suggestions to add to the mix!
https://docs.google.com/document/d/1N-pkg9zLigl06DTqzfQ9EM-7dZeALQl-oGxgSWDIL6s/edit?usp=sharing",1.5,Photocopy fee for public domain music handouts.,5.0,15,,,2,2015-05-03 14:10:31 -0400
2819,Performing Arts Rehearsal Tent,2015-07-31 14:30:00 -0400,2015-07-31 16:00:00 -0400,Lord Thomas Haworth,middle,4114,Being in Tune in Period,Performing Arts and Music,European,,false,"An introduction to the sound of tuning schemes using ratios, as used in medieval and Renaissance music. I use recorded sounds.","This class is an introduction to pitch and tuning in period. A was not 440, and equal temperament was only a (not very useful) theory. There were choices that had to be made in tuning fixed-pitch instruments like organs, harps, and fretted instruments. We will examine the theory and hear examples of four versions of the musical scale and the differences between them. These scales include the two musical tunings most commonly used in the medieval and Renaissance periods: Pythagorean and ¼-comma meantone. There will be no arithmetic required.",1.5,"",,20,,,2,2015-06-27 22:39:17 -0400
2575,A&S 1,2015-07-31 15:00:00 -0400,2015-07-31 16:00:00 -0400,Lord Dunstan Bramblette,middle,3802,Keeping Bees in the Knowne World,Pennsic University,Multiple Cultures,,false,Get an idea of what is involved in keeping bees in the here and now. I'll walk you through a typical year.,Get an idea of what is involved in keeping bees in the here and now. I'll walk you through a typical year.,1.0,"",,,,,1,2015-04-25 20:19:59 -0400
2812,A&S 3,2015-07-31 15:00:00 -0400,2015-07-31 17:00:00 -0400,Baroness Betha Symonds,æthelmearc,4103,Beginning Wire Weaving,Pennsic University,"",,false,"Students will learn to make intricate chains in the manner of the Vikings and other cultures, without need for heat or complicated tools.","This class will teach beginning students to make intricate chains in the manner of the Vikings and other ancient cultures, without the need for heat or complicated tools. With the techniques presented, you will learn to create items like the ones found in Viking burials and treasure hoards across the Nordic countries dating from the 9th century to the late 12th century. 

Wire chains made in this fashion have also been discovered in the British Isles (875 AD) and in the Roman, Greek and Byzantine civilizations from the 4th century BC to the 1st century AD. Timeless items can be created that are still beautiful and wearable today. 

If you have needle-nose pliers and wire cutters, please bring them. If you need glasses for close or small work, please bring them. The fee for the class includes the materials needed to complete the leather cord necklace. To view this unique jewelry, please visit www.AncientWire.com/book.htm.",2.0,"wire, pencil, tape, leather",1.0,,2.0,10,4,2015-04-30 20:45:12 -0400
2611,A&S 5,2015-07-31 15:00:00 -0400,2015-07-31 16:00:00 -0400,Instructor Gin,æthelmearc,3857,Ninja: Truth from Shadows,Pennsic University,Far Eastern,,false,Dare you look into the shadows of history to find the truth? Come to discover both the legends and real history of Japan's famed assassins. New info!,Dare you look into the shadows of history to find the truth? Come to discuss and discover both legends and the real history of Japan's famed spies and assassins. This class will examine the romanticized image of the Ninja and discuss the actual history of the world's most famous spies.,1.0,"",,20,,,4,2015-04-26 14:17:14 -0400
2402,A&S 8,2015-07-31 15:00:00 -0400,2015-07-31 16:00:00 -0400,Master Richard Wymarc,atlantia,3549,Telling Time with Richard II,Pennsic University,"",,false,"The theory and use of a simple time-keeping device called a Horary Quadrant, in particular one based on several associated with King Richard II. ","The theory and use of a simple time-keeping device called a Horary Quadrant, in particular one based on several associated with King Richard II. This class will give the historical context for the horary quadrant and provide extensive hands-on, practical experience in using it. ",1.0,Covers the cost of handout and an example quadrant for each student,4.0,15,,,2,2015-04-10 19:01:44 -0400
2699,A&S 9,2015-07-31 15:00:00 -0400,2015-07-31 17:00:00 -0400,Mistress Amelie d'Anjou,middle,3939,Music Pre-1200,Performing Arts and Music,Multiple Cultures,,false,"We'll start at 1200 A.D. in Western Europe, then work our way backwards, including Tang Dynasty China and Ancient Egypt. Let's see what we can find! ","We'll start at 1200 A.D. in Western Europe (very traditional history), but then work our way backwards in a whirlwind tour of three continents and stretching back as far as we can -- we might even get to the Egyptians and Sumerians! There is definitely some Chinese music from the Tang Dynasty extant -- let's see what we can find! ",2.0,donation for handout,1.0,20,,,1,2015-04-30 20:19:12 -0400
3046,A&S 14,2015-07-31 15:00:00 -0400,2015-07-31 16:00:00 -0400,Lady Jael ben Ari,middle,4438,When in Rome: The Odd and Risque ,Pennsic University,Other,,true,An overview of the more salacious aspects of Ancient Rome.,"",1.0,"",,20,,,1,2015-05-04 08:08:16 -0400
2985,Dance Tent,2015-07-31 15:00:00 -0400,2015-07-31 16:00:00 -0400,Pennsic Dance Staff,"",4335,Beginner Dance: 15th-Century Italian B,European Dance,European,,false,"Never danced before? No problem! We'll start with basic steps and patterns, and then teach fun, simple dances from 15th-century Italy.","",1.0,"",,,,,1,2015-05-03 13:50:05 -0400
2226,East Battlefield,2015-07-31 15:00:00 -0400,2015-07-31 17:00:00 -0400,THL Morien MacBain,æthelmearc,3257,Fiore/Lichtenauer Longsword Tourney,Martial Activities,European,,true,"Longsword-only heavy tourney devoted to the masters of the two traditions. Prizes awarded for best technique, best 14th-15th-century kit, and victory!","Longsword-only heavy tourney devoted to the masters of the two traditions. Prizes awarded for best technique, best 14th-15th-century kit, and victory!",2.0,"",,,,,1,2015-03-11 21:34:14 -0400
2668,Games Tent,2015-07-31 15:00:00 -0400,2015-07-31 16:00:00 -0400,Lord István Nyiregyhazi,east,3912,Tarot and other Card Games,Games,European,,false,"A review of the card games previously taught, including the game of tarot. Practice playing them with an instructor's assistance.","This class will review the card games previously taught, including tarot. You can practice playing them with an instructor's assistance.",1.0,"",,,,,2,2015-05-07 18:20:46 -0400
2243,Livonia Smithery (170),2015-07-31 15:00:00 -0400,2015-07-31 16:00:00 -0400,Lord T W,æthelmearc,3431,Advanced Engraving,Pennsic University,"",,true,The continuation of the work begun in the beginning class. Hand-engraving on copper plate. Letters and design work.,The continuation of the work begun in the beginning class. Hand-engraving on copper plate. Letters and design work.,1.0,handout,5.0,12,,,5,2015-04-08 17:51:30 -0400
3158,Manx Hall (E28),2015-07-31 15:00:00 -0400,2015-07-31 16:00:00 -0400,Aibinn ingen hui Ciardha ,middle,4572,"Spinners Anonymous, a.k.a Spinning for Cat-Herders",Pennsic University,Multiple Cultures,,false,"All spinners welcome to trade tips, learn technique and practice supported and drop spinning, with stone or clay whorl spindles; child-friendly camp. ","Wanted to take a spinning class, but couldn't find a sitter? Made it to that class, but want more practice with an experienced spinner? All spinners of all levels are invited to take part in this practicum on using the medieval spindle with clay or stone whorls for supported and drop spinning. Bring your own or use mine!  Spindles, whorls, wool and hand distaffs available. Cotton and flax spinning may also be discussed if there is an interest. Children are welcome to come play with mine while you play with fiber! Located in cool, shaded E-28 block.",1.0,"",,,,15,3,2015-05-24 15:21:59 -0400
2942,Novelty Range,2015-07-31 15:00:00 -0400,2015-07-31 17:00:00 -0400,Lord Gehrig Reimundson,caid,4244,"Fast Archery, Toxic Arrows: Lars Andersen & Beyond",Archery,Multiple Cultures,,false,Learn to perform and understand various techniques of speed shooting from a student (& consultant) of Lars Andersen with a lecture on arrow poisons.,"Arrows Quick and Venomous: Speed Shooting and Archer's Poisons
We've all seen the videos... some of us love them, some of us hate them... so here is your chance to learn how to use the techniques shown by someone who learned from Lars Andersen himself. The class will cover various styles of speed shooting for both target and combat archery. It will involve some history but more instruction in the speed shooting section, plus some instruction but more history regarding arrow poisons. Hopefully, the class will help expand your understanding of historical archery and help you apply it to your own archery.

People of all levels are welcome, especially those who have never shot a bow before. Folks with no habits may find it easier to apply these techniques than those who already have muscle memory regarding archery. 

Please bring whatever gloves, bows, and/or arrows you may have; a willingness to share will be appreciated. Strong preference for bows with no shelves.",2.0,"5 dollars handout, 10 dollars for materials with estimated room for about 30 students per class",5.0,,10.0,,2,2015-05-06 21:27:23 -0400
2922,White List,2015-07-31 15:00:00 -0400,2015-07-31 16:00:00 -0400,Duke Vissevald Selkirksson,east,4223,The Poleax Techniques of Paulus Hector Mair,Martial Activities,European,,false,Period poleax techniques that stress using the width of the ax in both defensive and offensive fashion applicable to SCA heavy list use.,Period poleax techniques that stress using the width of the ax in both defensive and offensive fashion applicable to SCA heavy list use.,1.0,"",,,,,4,2015-05-05 16:38:49 -0400
3134,Youth Combat List,2015-07-31 15:00:00 -0400,2015-07-31 17:00:00 -0400,Lord Sven,middle,4531,Afternoon Youth Combat,Youth Combat,"",,false,Afternoon Youth Combat,Afternoon Youth Combat,2.0,"",,,,,8,2015-05-13 19:59:52 -0400
3000,Middle Eastern Tent,2015-07-31 15:30:00 -0400,2015-07-31 17:30:00 -0400,Jowhara,middle,4348,ISIS Wings,Middle Eastern,Other,,false,Ancient belly dance myth meets contemporary pizzazz with ISIS wings! Wear your wings and learn Egyptian-style belly dance routines. All welcome! ,Ancient belly dance myth meets contemporary pizzazz with ISIS wings. Wear your wings and foot wear! You will learn Egyptian-style belly dance routines with wings and also improvise with wings. At the end of class we will float and fly the streets and hills of Pennsic on our Fabulous Wings. Traveling musicians welcome! ,2.0,donations ,,,,,2,2015-05-04 19:23:50 -0400
2492,Performing Arts Tent,2015-07-31 15:30:00 -0400,2015-07-31 16:30:00 -0400,Pennsic Performing Arts,"",3683,"Pennsic Technical Theater: Lights, Stage, Action!",Performing Arts and Music,"",,true,"Come and learn about the behind-the-scenes tech theater of the Performing Arts Tent: building the stage, rigging curtains, running lights, and more!","",1.0,"",,,,,2,2015-04-26 19:35:03 -0400
2519,Archery Tent,2015-07-31 16:00:00 -0400,2015-07-31 17:30:00 -0400,Master Godric of Hamtun,east,3755,Target Archery Marshals' Meeting,Archery,"",,false,"All target archery marshals should meet in the marshals' tent on the Archery Range. Repeats on Aug 2, 4 pm, for those who missed Friday's meeting.","There will a target archery marshals' meeting in the marshals' tent on the Archery Range on Friday, July 31, at 4 pm. There will also be an archery marshals' meeting on Sunday, August 2, at 4 pm, for all those marshals who did not or could not make the meeting on Thursday.",1.5,"",,,,,2,2015-04-26 18:24:11 -0400
3079,A&S 2,2015-07-31 16:00:00 -0400,2015-07-31 17:30:00 -0400,THL Sciath ingen Chaennaig,ealdormere,4456,Heraldry Design Basics,Heraldry,Other,,false,"What better way to get your device submission in shape for Herald's Point, than by learning about heraldry design basics. ","What better way to get your device submission in shape for Herald's Point, than by learning about heraldry design basics. This class will include an introduction to device design, based on the SCA rules of Heraldry. Some one-on-one assistance will be provided.  ",1.5,Handouts: $2,2.0,10,,,3,2015-05-06 00:51:36 -0400
2789,A&S 5,2015-07-31 16:00:00 -0400,2015-07-31 18:00:00 -0400,Master Gunnarr Alfljot,middle,4078,Finishing Woven-Wire Chains,Pennsic University,European,,false,Discussion and demonstration includes drawing the chain and various end finishes and clasps.,"",2.0,"",,30,,,1,2015-04-29 22:51:18 -0400
2174,A&S 7,2015-07-31 16:00:00 -0400,2015-07-31 17:00:00 -0400,Lord Lucas Livingston,middle,3193,Binging with Bacchus or How to Be an Ass in Athens,Pennsic University,Multiple Cultures,,true,"Raise your *rhyton* to the art & culture of beer and wine, brewing and vintning, from Egyptian sands to Greek shores. Tasting & BYOB! Over 21 only.","Raise your *rhyton* to the ancient art and culture of beer and wine from the sands of Ancient Egypt to the salty shores of Classical Greece. See how the ancient culture of drink left its mark on medieval and modern times. We'll delve into the ancient processes of brewing and vintning, and explore exquisite works of ancient art celebrating the drinking culture from King Tut's tomb, Agamemnon's Mycenae, Plato's Athens, and more. BYOB & enjoy a tasting of some new selections this year of various ancient-inspired, home-brewed, mad fermentations! Note: Over 21 only.",1.0,0,,20,,,1,2015-03-01 14:20:19 -0500
2538,A&S 10,2015-07-31 16:00:00 -0400,2015-07-31 18:00:00 -0400,Lady Mikalina Lydushka Pavlovna,east,3768,"Salts, from White to Dark!",Pennsic University,Multiple Cultures,,false,"Covers the diverse range of salts, from shore to shore and from plain to smoked! ","This class covers the diverse range of salts, from shore to shore and from plain to smoked! This is a variation on the salt class I taught last year focusing mainly on the diverse types of salt as well as making smoked salts. This covers their different histories, uses in religious events and their many uses in food prep, drinks and sweets. Some recipes will be available in the handout. There will be salt tasting, plus cucumber and bread and water for palate cleansing. ",2.0,"Handout, cucumber, water and bread for palate cleansing. ",2.0,30,3.0,30,1,2015-04-23 17:21:24 -0400
2293,A&S 11,2015-07-31 16:00:00 -0400,2015-07-31 16:45:00 -0400,Lord Rauf le Brewere,lochac,3339,Pimp My Wine,Pennsic University,European,,false,"Learn how to ""Pimp My Wine"" and turn everyday wine into a period-style hypocras full of spice and yumminess. Tastings so bring ID. Age 21 and over.","Just like ""Pimp My Ride"" takes an ordinary old car and turns it into a masterpiece, this class will show you how to turn your normal everyday wine into a period-style hypocras full of spice and yumminess. Alcoholic and non-alcoholic version will be available for sample during the class so please remember your ID. Age 21 and over.",0.75,"",,,,,4,2015-03-26 15:52:31 -0400
3055,Caer Ciunniunt  (E01),2015-07-31 16:00:00 -0400,2015-07-31 18:00:00 -0400,Mistress Rowena ni Dhonnchaidh,æthelmearc,4464,"Pennsic Homes, Part 2: Tour",Pennsic University,"",,false,"A tour of  Pennsic homes, followed by a group discussion/meet & greet at a lovely private camp. Follow-up to slideshow class. Bring your Pennsic map.","A tour of some of the Pennsic homes, followed by a group discussion/meet & greet at a lovely private camp. Follow-up to slideshow class on Thursday. Please bring your Pennsic booklet/map to mark down locations that you can visit that we didn't see.",2.0,"",,,,,1,2015-05-20 20:42:59 -0400
2604,Dance Tent,2015-07-31 16:00:00 -0400,2015-07-31 17:30:00 -0400,Lady Rebecca da Firenze,west,3855,*Furioso all'Italiano*,European Dance,European,,false,"Come learn *Furioso all'Italiano*, a 16th-C Italian dance for sets of three couples. Dancers of all ages welcome. This is an advanced class.","",1.5,"",,,,,1,2015-05-07 12:35:27 -0400
2872,Performing Arts Rehearsal Tent,2015-07-31 16:00:00 -0400,2015-07-31 17:00:00 -0400,Mistress Jadwiga Krzyzanowska,middle,4179,Reading from Facsimile,Performing Arts and Music,"",,false,Bring your instruments and we'll play through some 16th-century music in facsimile. Get ready to read in C clefs! ,"",1.0,"copies
",1.0,10,,,3,2015-05-06 01:27:16 -0400
2913,Pine Box Traders (192),2015-07-31 16:00:00 -0400,2015-07-31 17:30:00 -0400,THL Egill the Loomwright,calontir,4260,Card-Weaving Basics,Pennsic University,"",,false,"Using the continuous warping method, you will warp the loom and, using cards, you will weave a trim strip.","Warp a loom and weave a small strap or trim piece. Using the continuous warping method, you will warp the loom and weave a trim strip. Classroom loaner looms available or bring your own. Fee covers string and cards; take your work home with you.",1.5,cards & string,,,5.0,,6,2015-05-01 09:00:42 -0400
